number,value,datetime_start,datetime_complete,duration,params_batch,params_dropout,params_lookback,params_lr,params_optimizer,params_units,user_attrs_epochs,state
0,0.16365987062454224,2026-08-05 22:52:13.460530,2026-08-05 22:52:15.174390,0 days 00:00:01.713860,16,0.11620630175773605,8,0.000475646677807538,Adam,16,33,COMPLETE
1,0.00758689921349287,2026-08-05 22:52:15.174743,2026-08-05 22:52:17.600084,0 days 00:00:02.425341,16,0.3848426898655319,8,0.0009835709213816147,RMSprop,16,61,COMPLETE
2,0.014568960294127464,2026-08-05 22:52:17.600454,2026-08-05 22:52:19.735674,0 days 00:00:02.135220,16,0.4446768886882,4,0.00048331479218660477,RMSprop,16,55,COMPLETE
3,0.024702731519937515,2026-08-05 22:52:19.736113,2026-08-05 22:52:21.119907,0 days 00:00:01.383794,8,0.3908033035623795,4,0.0002852610998715986,Adam,32,16,COMPLETE
4,0.10433343797922134,2026-08-05 22:52:21.120297,2026-08-05 22:52:23.654725,0 days 00:00:02.534428,16,0.18068330783589812,13,0.0005848924534552655,Adam,32,51,COMPLETE
5,0.14871369302272797,2026-08-05 22:52:23.655079,2026-08-05 22:52:28.060550,0 days 00:00:04.405471,8,0.33192588883757246,13,0.0006717284219094596,RMSprop,8,77,COMPLETE
6,0.026049289852380753,2026-08-05 22:52:28.060924,2026-08-05 22:52:33.874826,0 days 00:00:05.813902,8,0.13488866909424657,8,0.00034184747997531036,RMSprop,8,150,COMPLETE
7,0.015895891934633255,2026-08-05 22:52:33.875182,2026-08-05 22:52:35.548266,0 days 00:00:01.673084,8,0.2981911129173771,8,0.0007901685926628595,Adam,16,29,COMPLETE
8,0.03137654811143875,2026-08-05 22:52:35.548624,2026-08-05 22:52:37.897084,0 days 00:00:02.348460,16,0.353466415998214,8,0.00016038604989350902,RMSprop,16,62,COMPLETE
9,0.015918951481580734,2026-08-05 22:52:37.897452,2026-08-05 22:52:43.957483,0 days 00:00:06.060031,16,0.23433205427400516,13,0.00011761887979211841,Adam,16,150,COMPLETE
10,0.0264374278485775,2026-08-05 22:52:43.957856,2026-08-05 22:52:45.465525,0 days 00:00:01.507669,16,0.4494192558132475,8,0.000974356213907901,RMSprop,8,31,COMPLETE
11,0.07658541202545166,2026-08-05 22:52:45.465883,2026-08-05 22:52:46.716512,0 days 00:00:01.250629,16,0.4465296376771116,4,0.00041299081562472576,RMSprop,16,23,COMPLETE
12,0.015052799135446548,2026-08-05 22:52:46.716884,2026-08-05 22:52:50.343501,0 days 00:00:03.626617,16,0.3855836861089641,4,0.00023920511007423067,RMSprop,16,121,COMPLETE
13,0.007159036584198475,2026-08-05 22:52:50.343908,2026-08-05 22:52:52.106988,0 days 00:00:01.763080,16,0.3934470260374766,4,0.0009331488586830357,RMSprop,16,43,COMPLETE
14,0.029995067045092583,2026-08-05 22:52:52.107371,2026-08-05 22:52:53.282276,0 days 00:00:01.174905,16,0.2580005731201229,4,0.0009310389551806339,RMSprop,32,19,COMPLETE
15,0.006309622898697853,2026-08-05 22:52:53.282649,2026-08-05 22:52:55.418756,0 days 00:00:02.136107,16,0.38861388296004895,8,0.0006572642894523451,RMSprop,16,53,COMPLETE
16,0.005686728749424219,2026-08-05 22:52:55.419163,2026-08-05 22:52:57.338180,0 days 00:00:01.919017,16,0.311333123684885,4,0.0006385484626614206,RMSprop,16,51,COMPLETE
17,0.06196805462241173,2026-08-05 22:52:57.338540,2026-08-05 22:52:59.620331,0 days 00:00:02.281791,16,0.303701014939728,4,0.0006183294479411033,RMSprop,16,65,COMPLETE
18,0.0855681374669075,2026-08-05 22:52:59.620700,2026-08-05 22:53:01.090767,0 days 00:00:01.470067,8,0.23149401178919782,8,0.00021279927800422444,RMSprop,8,26,COMPLETE
19,0.03226371854543686,2026-08-05 22:53:01.091131,2026-08-05 22:53:02.654179,0 days 00:00:01.563048,16,0.3390479191727983,13,0.00040551351113194735,RMSprop,32,26,COMPLETE
20,0.01045138482004404,2026-08-05 22:53:02.654574,2026-08-05 22:53:05.277354,0 days 00:00:02.622780,16,0.28725049597115937,8,0.00069032243763636,RMSprop,16,69,COMPLETE
21,0.03149395063519478,2026-08-05 22:53:05.277738,2026-08-05 22:53:06.357394,0 days 00:00:01.079656,16,0.40705248901385727,4,0.0007838742860286872,RMSprop,16,16,COMPLETE
22,0.011249496601521969,2026-08-05 22:53:06.357823,2026-08-05 22:53:08.667885,0 days 00:00:02.310062,16,0.3592286106202684,4,0.0005526054718279764,RMSprop,16,68,COMPLETE
23,0.01671341061592102,2026-08-05 22:53:08.668234,2026-08-05 22:53:09.734813,0 days 00:00:01.066579,16,0.41604839560886253,4,0.0007692979894002486,RMSprop,16,16,COMPLETE
24,0.06498898565769196,2026-08-05 22:53:09.735237,2026-08-05 22:53:11.384291,0 days 00:00:01.649054,16,0.3153952056703521,4,0.0004973689522938234,RMSprop,16,39,COMPLETE
25,0.006383884698152542,2026-08-05 22:53:11.384672,2026-08-05 22:53:13.869111,0 days 00:00:02.484439,16,0.36889629540149504,4,0.0008224054849330314,RMSprop,16,74,COMPLETE
26,0.01822129637002945,2026-08-05 22:53:13.869499,2026-08-05 22:53:15.287689,0 days 00:00:01.418190,8,0.2640330547518355,4,0.00036972154095936963,Adam,16,19,COMPLETE
27,0.014198665507137775,2026-08-05 22:53:15.288048,2026-08-05 22:53:19.536961,0 days 00:00:04.248913,16,0.35924284620314645,4,0.00029474861244223425,RMSprop,16,147,COMPLETE
28,0.020026816055178642,2026-08-05 22:53:19.537512,2026-08-05 22:53:22.228653,0 days 00:00:02.691141,16,0.32839877134161727,13,0.0007990143515656842,RMSprop,8,64,COMPLETE
29,0.04068578779697418,2026-08-05 22:53:22.229022,2026-08-05 22:53:23.591160,0 days 00:00:01.362138,16,0.37057021641536786,8,0.0004535458836173792,Adam,32,21,COMPLETE
30,0.02905263565480709,2026-08-05 22:53:23.591533,2026-08-05 22:53:26.001828,0 days 00:00:02.410295,16,0.41355471251423115,8,0.0005882548917470492,RMSprop,16,65,COMPLETE
31,0.07005072385072708,2026-08-05 22:53:26.002196,2026-08-05 22:53:28.990636,0 days 00:00:02.988440,16,0.42036225324505533,4,0.0008990253410363453,RMSprop,16,97,COMPLETE
32,0.014752891846001148,2026-08-05 22:53:28.991013,2026-08-05 22:53:31.200240,0 days 00:00:02.209227,16,0.38183325594747664,4,0.000698681373943188,RMSprop,16,64,COMPLETE
33,0.024454953148961067,2026-08-05 22:53:31.200597,2026-08-05 22:53:33.311818,0 days 00:00:02.111221,16,0.3491888175224926,4,0.000861021284514341,RMSprop,16,58,COMPLETE
34,0.009604339487850666,2026-08-05 22:53:33.312188,2026-08-05 22:53:35.060358,0 days 00:00:01.748170,16,0.40120298818718625,4,0.000692568351248048,RMSprop,16,44,COMPLETE
35,0.01928391121327877,2026-08-05 22:53:35.060732,2026-08-05 22:53:36.653652,0 days 00:00:01.592920,16,0.4265980786819773,4,0.0009826602859916557,RMSprop,16,38,COMPLETE
36,0.021628111600875854,2026-08-05 22:53:36.654015,2026-08-05 22:53:40.218893,0 days 00:00:03.564878,16,0.3701596989142475,4,0.0005657978986788931,Adam,16,114,COMPLETE
37,0.008409291505813599,2026-08-05 22:53:40.219269,2026-08-05 22:53:42.267847,0 days 00:00:02.048578,8,0.39199729170849984,8,0.0005077681528928018,RMSprop,32,42,COMPLETE
38,0.026645809412002563,2026-08-05 22:53:42.268207,2026-08-05 22:53:44.391075,0 days 00:00:02.122868,16,0.318907364548637,13,0.0006445025144984639,RMSprop,16,44,COMPLETE
39,0.09360738843679428,2026-08-05 22:53:44.391461,2026-08-05 22:53:45.711885,0 days 00:00:01.320424,8,0.1890003534447578,4,0.0008432492432451437,Adam,8,16,COMPLETE
40,0.006851989775896072,2026-08-05 22:53:45.712262,2026-08-05 22:53:48.154584,0 days 00:00:02.442322,16,0.3391933523197189,8,0.0007411343939858512,RMSprop,16,64,COMPLETE
41,0.005092790815979242,2026-08-05 22:53:48.154938,2026-08-05 22:53:50.644517,0 days 00:00:02.489579,16,0.34336541173370355,8,0.0007551928197521039,RMSprop,16,67,COMPLETE
42,0.27347975969314575,2026-08-05 22:53:50.644863,2026-08-05 22:53:51.713968,0 days 00:00:01.069105,16,0.3379803244418227,8,0.0007446177700227089,RMSprop,16,16,COMPLETE
43,0.014870543964207172,2026-08-05 22:53:51.714343,2026-08-05 22:53:53.385630,0 days 00:00:01.671287,16,0.2887848507944165,8,0.0005279403116180047,RMSprop,16,36,COMPLETE
44,0.026835214346647263,2026-08-05 22:53:53.386007,2026-08-05 22:53:54.770635,0 days 00:00:01.384628,16,0.31443383735724983,8,0.0006363093448850166,RMSprop,16,27,COMPLETE
45,0.29418468475341797,2026-08-05 22:53:54.771006,2026-08-05 22:53:55.865601,0 days 00:00:01.094595,16,0.11957257772101879,8,0.00043871709771734255,RMSprop,16,16,COMPLETE
46,0.03507577255368233,2026-08-05 22:53:55.866019,2026-08-05 22:53:56.961049,0 days 00:00:01.095030,16,0.37271573589361623,8,0.0007310718105792707,RMSprop,16,16,COMPLETE
47,0.01660223864018917,2026-08-05 22:53:56.961447,2026-08-05 22:53:58.512130,0 days 00:00:01.550683,8,0.34481737737966545,8,0.00014536761488637126,RMSprop,32,28,COMPLETE
48,0.0858195424079895,2026-08-05 22:53:58.512486,2026-08-05 22:54:02.193757,0 days 00:00:03.681271,16,0.3239076369557901,8,0.0008475986156733392,Adam,8,108,COMPLETE
49,0.06565175950527191,2026-08-05 22:54:02.194214,2026-08-05 22:54:03.296329,0 days 00:00:01.102115,16,0.2950032709956814,8,0.0006147315652886152,RMSprop,16,16,COMPLETE
50,0.03662921488285065,2026-08-05 22:54:03.296736,2026-08-05 22:54:04.439335,0 days 00:00:01.142599,16,0.24056905143727952,8,0.0006767006743986095,RMSprop,16,18,COMPLETE
51,0.008717963472008705,2026-08-05 22:54:04.439699,2026-08-05 22:54:07.527150,0 days 00:00:03.087451,16,0.4317016090043789,13,0.0008908288360773893,RMSprop,16,76,COMPLETE
52,0.02024071104824543,2026-08-05 22:54:07.527538,2026-08-05 22:54:09.122375,0 days 00:00:01.594837,16,0.3953903400374942,8,0.0009666486653211322,RMSprop,16,35,COMPLETE
53,0.006646515801548958,2026-08-05 22:54:09.122740,2026-08-05 22:54:11.707820,0 days 00:00:02.585080,16,0.35827457453658557,4,0.0007770378097710122,RMSprop,16,79,COMPLETE
54,0.004786012228578329,2026-08-05 22:54:11.708200,2026-08-05 22:54:13.453891,0 days 00:00:01.745691,16,0.35886979396625507,4,0.0008003568430482401,RMSprop,16,43,COMPLETE
55,0.013470214791595936,2026-08-05 22:54:13.454416,2026-08-05 22:54:15.507544,0 days 00:00:02.053128,16,0.37705774359886735,4,0.0008244925050796488,RMSprop,16,56,COMPLETE
56,0.11357907205820084,2026-08-05 22:54:15.507917,2026-08-05 22:54:19.848748,0 days 00:00:04.340831,16,0.3633639721424327,4,0.00021350469354179083,RMSprop,16,150,COMPLETE
57,0.03575872629880905,2026-08-05 22:54:19.849222,2026-08-05 22:54:21.777852,0 days 00:00:01.928630,8,0.3061585399699384,4,0.0005593310005707492,RMSprop,16,37,COMPLETE
58,0.015160903334617615,2026-08-05 22:54:21.778253,2026-08-05 22:54:24.203937,0 days 00:00:02.425684,16,0.27190473971830786,4,0.0006158534444944386,RMSprop,8,71,COMPLETE
59,0.01953667588531971,2026-08-05 22:54:24.204305,2026-08-05 22:54:25.787061,0 days 00:00:01.582756,16,0.35628656644516443,4,0.0007889387000484141,RMSprop,32,36,COMPLETE
60,0.13445885479450226,2026-08-05 22:54:25.787447,2026-08-05 22:54:30.312592,0 days 00:00:04.525145,16,0.33258291420596364,4,0.0003651996509802618,Adam,16,150,COMPLETE
61,0.007545585744082928,2026-08-05 22:54:30.312943,2026-08-05 22:54:34.421833,0 days 00:00:04.108890,16,0.34553707489522256,8,0.000727900717485659,RMSprop,16,125,COMPLETE
62,0.1078835055232048,2026-08-05 22:54:34.422384,2026-08-05 22:54:35.587773,0 days 00:00:01.165389,16,0.33214140200261444,13,0.0007503562575973975,RMSprop,16,16,COMPLETE
63,0.025356071069836617,2026-08-05 22:54:35.588157,2026-08-05 22:54:39.236703,0 days 00:00:03.648546,16,0.38610788675269053,4,0.0006668117507326605,RMSprop,16,122,COMPLETE
64,0.0074956780299544334,2026-08-05 22:54:39.237107,2026-08-05 22:54:41.599710,0 days 00:00:02.362603,16,0.35301291236441235,8,0.0009217878906834624,RMSprop,16,62,COMPLETE
65,0.05449884012341499,2026-08-05 22:54:41.600079,2026-08-05 22:54:43.438381,0 days 00:00:01.838302,16,0.30983182059234615,4,0.0008131499204605598,RMSprop,16,47,COMPLETE
66,0.015283390879631042,2026-08-05 22:54:43.438748,2026-08-05 22:54:45.693745,0 days 00:00:02.254997,16,0.36216491843840976,4,0.0009962646873812216,RMSprop,16,64,COMPLETE
67,0.01206350140273571,2026-08-05 22:54:45.694159,2026-08-05 22:54:47.086611,0 days 00:00:01.392452,16,0.40628514598409826,8,0.0005897354295771512,RMSprop,16,27,COMPLETE
68,0.013167989440262318,2026-08-05 22:54:47.086990,2026-08-05 22:54:48.650021,0 days 00:00:01.563031,16,0.3434797886981171,4,0.0007092015515610476,RMSprop,16,36,COMPLETE
69,0.04465406760573387,2026-08-05 22:54:48.650385,2026-08-05 22:54:50.386880,0 days 00:00:01.736495,8,0.37572703324566975,8,0.00048559036258209357,RMSprop,16,34,COMPLETE
70,0.02028357796370983,2026-08-05 22:54:50.387244,2026-08-05 22:54:52.659835,0 days 00:00:02.272591,16,0.32550702757811284,4,0.0005347864033208585,RMSprop,8,67,COMPLETE
71,0.010410654358565807,2026-08-05 22:54:52.660230,2026-08-05 22:54:55.785720,0 days 00:00:03.125490,16,0.3946630543683976,4,0.0009112903479915823,RMSprop,16,101,COMPLETE
72,0.013956735841929913,2026-08-05 22:54:55.786135,2026-08-05 22:54:57.489663,0 days 00:00:01.703528,16,0.36265384577712323,4,0.0007647044090573404,RMSprop,16,42,COMPLETE
73,0.03303634375333786,2026-08-05 22:54:57.490036,2026-08-05 22:54:59.544052,0 days 00:00:02.054016,16,0.4367082921771366,4,0.0008737345345570896,RMSprop,16,57,COMPLETE
74,0.01616758666932583,2026-08-05 22:54:59.544430,2026-08-05 22:55:00.977015,0 days 00:00:01.432585,16,0.38723956631680617,4,0.0007884258674039461,RMSprop,16,30,COMPLETE
