number,value,datetime_start,datetime_complete,duration,params_batch,params_dropout,params_lookback,params_lr,params_optimizer,params_units,user_attrs_epochs,state
0,0.004140091594308615,2026-08-06 04:13:33.286357,2026-08-06 04:13:37.408238,0 days 00:00:04.121881,16,0.38619648117425276,4,0.0006319721357758888,RMSprop,16,63,COMPLETE
1,0.26922160387039185,2026-08-06 04:13:37.408637,2026-08-06 04:13:39.634588,0 days 00:00:02.225951,16,0.40451671179871596,13,0.00020567533078066948,Adam,8,16,COMPLETE
2,0.003718088148161769,2026-08-06 04:13:39.635247,2026-08-06 04:13:46.882593,0 days 00:00:07.247346,16,0.18241361553224753,13,0.0003245666849090358,Adam,8,150,COMPLETE
3,0.0026124371215701103,2026-08-06 04:13:46.882952,2026-08-06 04:13:51.602591,0 days 00:00:04.719639,8,0.4262379346680798,13,0.0006181861510594901,RMSprop,8,58,COMPLETE
4,0.0043756538070738316,2026-08-06 04:13:51.602964,2026-08-06 04:13:55.517891,0 days 00:00:03.914927,16,0.4243132379867871,4,0.0007312228596558532,Adam,32,54,COMPLETE
5,0.0033918493427336216,2026-08-06 04:13:55.518261,2026-08-06 04:14:01.781412,0 days 00:00:06.263151,16,0.2893825796458606,8,0.0008536966877851768,Adam,8,120,COMPLETE
6,0.0069001358933746815,2026-08-06 04:14:01.781852,2026-08-06 04:14:06.621456,0 days 00:00:04.839604,8,0.33466860662053133,4,0.0003747678126781331,RMSprop,16,66,COMPLETE
7,0.00668588699772954,2026-08-06 04:14:06.621844,2026-08-06 04:14:09.691874,0 days 00:00:03.070030,8,0.3922419403972017,13,0.0005475048522129221,RMSprop,16,27,COMPLETE
8,0.009633073583245277,2026-08-06 04:14:09.692298,2026-08-06 04:14:13.394072,0 days 00:00:03.701774,16,0.11426744665636585,13,0.0007675374830332515,RMSprop,16,61,COMPLETE
9,0.0038662885781377554,2026-08-06 04:14:13.394454,2026-08-06 04:14:17.339645,0 days 00:00:03.945191,16,0.13880026348827668,8,0.0009608071311692517,RMSprop,32,57,COMPLETE
10,0.011371755041182041,2026-08-06 04:14:17.340051,2026-08-06 04:14:27.109669,0 days 00:00:09.769618,8,0.23621140221518885,13,0.0001230962644761753,RMSprop,8,150,COMPLETE
11,0.003687188494950533,2026-08-06 04:14:27.110262,2026-08-06 04:14:36.443476,0 days 00:00:09.333214,8,0.2924666084064383,8,0.0005022725481291526,Adam,8,129,COMPLETE
12,0.004015770740807056,2026-08-06 04:14:36.443966,2026-08-06 04:14:43.228369,0 days 00:00:06.784403,8,0.316395212988585,8,0.0009460782527329433,Adam,8,87,COMPLETE
13,0.00513691920787096,2026-08-06 04:14:43.228755,2026-08-06 04:14:51.247512,0 days 00:00:08.018757,8,0.23774057379400435,8,0.0004506718807368821,Adam,8,106,COMPLETE
14,0.004257052671164274,2026-08-06 04:14:51.248058,2026-08-06 04:14:58.322758,0 days 00:00:07.074700,16,0.44950859931451903,8,0.00018643463731719449,RMSprop,8,150,COMPLETE
15,0.007082541007548571,2026-08-06 04:14:58.323135,2026-08-06 04:15:08.264545,0 days 00:00:09.941410,8,0.3469187524680858,13,0.00020981770654999917,Adam,8,150,COMPLETE
16,0.004975888878107071,2026-08-06 04:15:08.264944,2026-08-06 04:15:12.197393,0 days 00:00:03.932449,8,0.24996926998220798,8,0.0006968064594120063,RMSprop,32,40,COMPLETE
17,0.010092752985656261,2026-08-06 04:15:12.197760,2026-08-06 04:15:17.026735,0 days 00:00:04.828975,16,0.20464464436105656,8,0.00039131916368838614,Adam,8,71,COMPLETE
18,0.0024657933972775936,2026-08-06 04:15:17.027126,2026-08-06 04:15:26.638703,0 days 00:00:09.611577,8,0.3676893971207014,13,0.00025915659321465055,RMSprop,8,150,COMPLETE
19,0.002467733807861805,2026-08-06 04:15:26.639093,2026-08-06 04:15:32.015470,0 days 00:00:05.376377,8,0.36675958259044944,13,0.0002807834064239078,RMSprop,32,70,COMPLETE
20,0.0032373738940805197,2026-08-06 04:15:32.015878,2026-08-06 04:15:36.700322,0 days 00:00:04.684444,8,0.36673186223686177,13,0.0002602206567616775,RMSprop,32,56,COMPLETE
21,0.0032201590947806835,2026-08-06 04:15:36.701269,2026-08-06 04:15:42.347578,0 days 00:00:05.646309,8,0.43650794981601676,13,0.00028083213756118945,RMSprop,32,73,COMPLETE
22,0.006397135090082884,2026-08-06 04:15:42.347958,2026-08-06 04:15:51.988155,0 days 00:00:09.640197,8,0.3710510476051735,13,0.00015346251699743736,RMSprop,32,139,COMPLETE
23,0.005095385480672121,2026-08-06 04:15:51.988531,2026-08-06 04:15:57.458936,0 days 00:00:05.470405,8,0.41287256429350777,13,0.00025513687602663317,RMSprop,32,68,COMPLETE
24,0.003378823632374406,2026-08-06 04:15:57.459516,2026-08-06 04:16:02.553992,0 days 00:00:05.094476,8,0.3237790972834733,13,0.00035377653370931224,RMSprop,8,70,COMPLETE
25,0.016194986179471016,2026-08-06 04:16:02.554343,2026-08-06 04:16:04.775854,0 days 00:00:02.221511,8,0.3564884240861576,13,0.00016009446575631592,RMSprop,32,16,COMPLETE
26,0.0028156344778835773,2026-08-06 04:16:04.776217,2026-08-06 04:16:13.683407,0 days 00:00:08.907190,8,0.38847326130898047,13,0.0002919092997048029,RMSprop,8,139,COMPLETE
27,0.003273550420999527,2026-08-06 04:16:13.683797,2026-08-06 04:16:22.051713,0 days 00:00:08.367916,8,0.4174306287285719,4,0.00010145296581320856,RMSprop,8,150,COMPLETE
28,0.005615497473627329,2026-08-06 04:16:22.052090,2026-08-06 04:16:28.429685,0 days 00:00:06.377595,8,0.304929468404345,13,0.00022847517629818288,RMSprop,16,91,COMPLETE
29,0.0032984898425638676,2026-08-06 04:16:28.430090,2026-08-06 04:16:31.937348,0 days 00:00:03.507258,8,0.380137664600511,4,0.0005964715925827472,RMSprop,32,33,COMPLETE
30,0.0028704723808914423,2026-08-06 04:16:31.938014,2026-08-06 04:16:37.827030,0 days 00:00:05.889016,8,0.2702108419959739,13,0.0004290734318655876,RMSprop,8,84,COMPLETE
31,0.0037181798834353685,2026-08-06 04:16:37.827400,2026-08-06 04:16:43.622014,0 days 00:00:05.794614,8,0.3922525041112197,13,0.00031179183353539057,RMSprop,8,81,COMPLETE
32,0.003707831259816885,2026-08-06 04:16:43.622368,2026-08-06 04:16:47.677873,0 days 00:00:04.055505,8,0.3959602708451902,13,0.0002814985191934573,RMSprop,8,49,COMPLETE
33,0.0025205863639712334,2026-08-06 04:16:47.678270,2026-08-06 04:16:52.867340,0 days 00:00:05.189070,8,0.3416867866386379,13,0.0003260776021888342,RMSprop,8,70,COMPLETE
34,0.0030004503205418587,2026-08-06 04:16:52.867738,2026-08-06 04:17:00.215224,0 days 00:00:07.347486,8,0.34401641223881524,13,0.00023172727714585912,RMSprop,8,111,COMPLETE
35,0.003326136851683259,2026-08-06 04:17:00.215602,2026-08-06 04:17:09.616214,0 days 00:00:09.400612,8,0.4299720027621373,13,0.00018751072841825868,RMSprop,8,150,COMPLETE
36,0.003361655166372657,2026-08-06 04:17:09.616575,2026-08-06 04:17:14.356336,0 days 00:00:04.739761,8,0.32687484021874147,4,0.00033541346462155836,RMSprop,16,67,COMPLETE
37,0.0045801326632499695,2026-08-06 04:17:14.356684,2026-08-06 04:17:17.947307,0 days 00:00:03.590623,8,0.35871840662292376,13,0.00046051188030786424,RMSprop,8,40,COMPLETE
38,0.004327308386564255,2026-08-06 04:17:17.947669,2026-08-06 04:17:20.736633,0 days 00:00:02.788964,16,0.44923826758859675,13,0.00038453166125583863,RMSprop,32,39,COMPLETE
39,0.0067276316694915295,2026-08-06 04:17:20.736998,2026-08-06 04:17:26.005996,0 days 00:00:05.268998,8,0.4060157234897865,13,0.00024583311760995367,RMSprop,16,68,COMPLETE
40,0.004439175128936768,2026-08-06 04:17:26.006381,2026-08-06 04:17:30.030380,0 days 00:00:04.023999,16,0.373542652198676,4,0.0006585201935162939,RMSprop,8,77,COMPLETE
41,0.007136351894587278,2026-08-06 04:17:30.030904,2026-08-06 04:17:36.415104,0 days 00:00:06.384200,8,0.38704011247985787,13,0.00030996970063703987,RMSprop,8,90,COMPLETE
42,0.004208102356642485,2026-08-06 04:17:36.415470,2026-08-06 04:17:43.803354,0 days 00:00:07.387884,8,0.40752641717371907,13,0.00028672121046308737,RMSprop,8,112,COMPLETE
43,0.00631358940154314,2026-08-06 04:17:43.803814,2026-08-06 04:17:53.271484,0 days 00:00:09.467670,8,0.3413787598774139,13,0.00020910178477916378,RMSprop,8,150,COMPLETE
44,0.004450180567800999,2026-08-06 04:17:53.271885,2026-08-06 04:17:58.151001,0 days 00:00:04.879116,8,0.3077641773202844,13,0.0005369467296046144,RMSprop,8,65,COMPLETE
45,0.005013498943299055,2026-08-06 04:17:58.151343,2026-08-06 04:18:07.993537,0 days 00:00:09.842194,8,0.42531547230167144,13,0.00041245228943564293,Adam,8,150,COMPLETE
46,0.012358398176729679,2026-08-06 04:18:07.993933,2026-08-06 04:18:17.432858,0 days 00:00:09.438925,8,0.276105432837531,13,0.00017440013876881448,RMSprop,8,150,COMPLETE
47,0.003344966797158122,2026-08-06 04:18:17.433304,2026-08-06 04:18:21.050407,0 days 00:00:03.617103,8,0.35950823602366067,13,0.0007976804177021052,RMSprop,16,42,COMPLETE
48,0.008686178363859653,2026-08-06 04:18:21.050990,2026-08-06 04:18:27.932106,0 days 00:00:06.881116,16,0.3889382444251991,13,0.00034880884763778666,Adam,8,150,COMPLETE
49,0.004464213736355305,2026-08-06 04:18:27.932498,2026-08-06 04:18:33.424027,0 days 00:00:05.491529,8,0.15715273955345865,13,0.00048629324441027593,RMSprop,32,72,COMPLETE
50,0.003424205118790269,2026-08-06 04:18:33.424443,2026-08-06 04:18:39.697584,0 days 00:00:06.273141,8,0.3366282715079668,4,0.00029226991832433064,RMSprop,8,98,COMPLETE
51,0.0032289535738527775,2026-08-06 04:18:39.698395,2026-08-06 04:18:44.291497,0 days 00:00:04.593102,8,0.28907014021700145,13,0.0004181196896108183,RMSprop,8,57,COMPLETE
52,0.008542734198272228,2026-08-06 04:18:44.291927,2026-08-06 04:18:49.493977,0 days 00:00:05.202050,8,0.22004416377830505,13,0.0003212235541351367,RMSprop,8,71,COMPLETE
53,0.002857670420780778,2026-08-06 04:18:49.494474,2026-08-06 04:18:54.209491,0 days 00:00:04.715017,8,0.40223928430186173,13,0.0005528836869077858,RMSprop,8,60,COMPLETE
54,0.0033776238560676575,2026-08-06 04:18:54.209882,2026-08-06 04:18:58.032416,0 days 00:00:03.822534,8,0.4390195982730932,13,0.0005792387580598686,RMSprop,8,45,COMPLETE
55,0.003734826110303402,2026-08-06 04:18:58.032788,2026-08-06 04:19:04.259225,0 days 00:00:06.226437,8,0.4007077549825931,8,0.0008830078488403732,Adam,8,77,COMPLETE
56,0.0020617994014173746,2026-08-06 04:19:04.259647,2026-08-06 04:19:06.792891,0 days 00:00:02.533244,16,0.3778926455613991,13,0.0006684260331365923,RMSprop,32,30,COMPLETE
57,0.003214039374142885,2026-08-06 04:19:06.793253,2026-08-06 04:19:09.696945,0 days 00:00:02.903692,16,0.37778674314291294,13,0.0006907778864070514,RMSprop,32,41,COMPLETE
58,0.008987289853394032,2026-08-06 04:19:09.697302,2026-08-06 04:19:12.535900,0 days 00:00:02.838598,16,0.3487617967959672,13,0.00023104175385168542,RMSprop,32,40,COMPLETE
59,0.0034944056533277035,2026-08-06 04:19:12.536277,2026-08-06 04:19:16.408589,0 days 00:00:03.872312,16,0.3644234631649088,8,0.0002622895527704745,RMSprop,32,59,COMPLETE
60,0.0046488819643855095,2026-08-06 04:19:16.409021,2026-08-06 04:19:21.429494,0 days 00:00:05.020473,16,0.4178212228506411,13,0.0007820662789482012,Adam,32,89,COMPLETE
61,0.0033308316487818956,2026-08-06 04:19:21.430110,2026-08-06 04:19:25.188351,0 days 00:00:03.758241,16,0.3771117909188949,13,0.0005251347489144384,RMSprop,32,62,COMPLETE
62,0.004002167843282223,2026-08-06 04:19:25.188815,2026-08-06 04:19:29.244349,0 days 00:00:04.055534,8,0.39874134631727254,13,0.0007287948484274862,RMSprop,8,52,COMPLETE
63,0.004732135217636824,2026-08-06 04:19:29.244725,2026-08-06 04:19:31.711217,0 days 00:00:02.466492,8,0.4138462123960034,13,0.0006478840191719423,RMSprop,32,20,COMPLETE
64,0.004106912296265364,2026-08-06 04:19:31.711593,2026-08-06 04:19:36.387706,0 days 00:00:04.676113,8,0.3516544330337381,13,0.0006014342762384224,RMSprop,8,64,COMPLETE
65,0.0036362111568450928,2026-08-06 04:19:36.388148,2026-08-06 04:19:39.267625,0 days 00:00:02.879477,16,0.32948390243028125,13,0.0009124039806629857,RMSprop,16,45,COMPLETE
66,0.003396501997485757,2026-08-06 04:19:39.268026,2026-08-06 04:19:44.814117,0 days 00:00:05.546091,8,0.3840949914437622,13,0.00037789563483859196,RMSprop,8,71,COMPLETE
67,0.0033789712470024824,2026-08-06 04:19:44.814514,2026-08-06 04:19:48.702426,0 days 00:00:03.887912,8,0.43244877853882013,13,0.0004963322038542753,RMSprop,32,46,COMPLETE
68,0.004016133490949869,2026-08-06 04:19:48.702812,2026-08-06 04:19:56.334422,0 days 00:00:07.631610,8,0.3159638069808616,4,0.00019818554059534133,RMSprop,8,135,COMPLETE
69,0.0031638124492019415,2026-08-06 04:19:56.334801,2026-08-06 04:20:03.064993,0 days 00:00:06.730192,8,0.3681792753440699,13,0.000267060636363951,RMSprop,8,100,COMPLETE
70,0.004514337982982397,2026-08-06 04:20:03.065379,2026-08-06 04:20:08.933249,0 days 00:00:05.867870,16,0.444037613309626,8,0.00013611040657173127,RMSprop,32,116,COMPLETE
71,0.0035732612013816833,2026-08-06 04:20:08.933656,2026-08-06 04:20:12.733777,0 days 00:00:03.800121,8,0.2679620682258604,13,0.0005648363427354153,RMSprop,8,48,COMPLETE
72,0.0035092143807560205,2026-08-06 04:20:12.734178,2026-08-06 04:20:21.274220,0 days 00:00:08.540042,8,0.24718410325162427,13,0.0004410795320215298,RMSprop,8,134,COMPLETE
73,0.0016084712697193027,2026-08-06 04:20:21.274571,2026-08-06 04:20:27.054260,0 days 00:00:05.779689,8,0.25890829600776727,13,0.00030130374948280004,RMSprop,8,78,COMPLETE
74,0.0034172351006418467,2026-08-06 04:20:27.054720,2026-08-06 04:20:35.479228,0 days 00:00:08.424508,8,0.392447964541184,13,0.0003008558896705818,RMSprop,8,128,COMPLETE
