number,value,datetime_start,datetime_complete,duration,params_batch,params_dropout,params_lookback,params_lr,params_optimizer,params_units,user_attrs_epochs,state
0,0.02225080505013466,2026-08-06 03:16:30.440310,2026-08-06 03:16:35.298705,0 days 00:00:04.858395,16,0.3534619858820658,8,0.00015199812076077652,RMSprop,16,150,COMPLETE
1,0.0190702173858881,2026-08-06 03:16:35.299087,2026-08-06 03:16:37.941983,0 days 00:00:02.642896,16,0.2974585257935402,13,0.0005812480038401413,RMSprop,32,41,COMPLETE
2,0.051467251032590866,2026-08-06 03:16:37.942364,2026-08-06 03:16:43.074032,0 days 00:00:05.131668,16,0.24804694365345278,8,0.0001061279343711878,Adam,16,150,COMPLETE
3,0.010076886974275112,2026-08-06 03:16:43.074391,2026-08-06 03:16:46.043197,0 days 00:00:02.968806,8,0.32207011873197056,4,0.0006801544195859344,RMSprop,8,50,COMPLETE
4,0.0071530090644955635,2026-08-06 03:16:46.043544,2026-08-06 03:16:48.396238,0 days 00:00:02.352694,8,0.20940943082929978,8,0.00039347935052789135,Adam,8,36,COMPLETE
5,0.012625097297132015,2026-08-06 03:16:48.396631,2026-08-06 03:16:51.851355,0 days 00:00:03.454724,8,0.3395517982432361,8,0.0008871142472513559,Adam,32,58,COMPLETE
6,0.020752253010869026,2026-08-06 03:16:51.851744,2026-08-06 03:17:01.003446,0 days 00:00:09.151702,8,0.41967457679738207,13,0.00031352138468013614,Adam,8,130,COMPLETE
7,0.018141934648156166,2026-08-06 03:17:01.003821,2026-08-06 03:17:07.965382,0 days 00:00:06.961561,8,0.18642008030523538,4,0.00011431115527413366,RMSprop,8,150,COMPLETE
8,0.02057476155459881,2026-08-06 03:17:07.965811,2026-08-06 03:17:13.071893,0 days 00:00:05.106082,16,0.4232517801099846,8,0.0002875531734560785,Adam,8,150,COMPLETE
9,0.005620639305561781,2026-08-06 03:17:13.072313,2026-08-06 03:17:16.621199,0 days 00:00:03.548886,8,0.1889048447331438,13,0.000984390608511336,RMSprop,32,41,COMPLETE
10,0.010010331869125366,2026-08-06 03:17:16.621609,2026-08-06 03:17:24.719890,0 days 00:00:08.098281,8,0.12371108830002966,13,0.00020914052297699157,RMSprop,32,112,COMPLETE
11,0.009688288904726505,2026-08-06 03:17:24.720259,2026-08-06 03:17:32.796141,0 days 00:00:08.075882,8,0.21356414123130985,13,0.0004796234063321475,Adam,32,106,COMPLETE
12,0.012877288274466991,2026-08-06 03:17:32.796873,2026-08-06 03:17:37.794177,0 days 00:00:04.997304,8,0.15086773519688648,8,0.0009913056601266602,Adam,8,99,COMPLETE
13,0.007853390648961067,2026-08-06 03:17:37.794569,2026-08-06 03:17:41.405843,0 days 00:00:03.611274,8,0.23826388321506248,13,0.0004156507450473002,RMSprop,32,42,COMPLETE
14,0.04090758413076401,2026-08-06 03:17:41.406250,2026-08-06 03:17:48.639525,0 days 00:00:07.233275,8,0.17981734956314455,4,0.00021133905610330557,RMSprop,16,150,COMPLETE
15,0.014192109927535057,2026-08-06 03:17:48.639921,2026-08-06 03:17:53.506744,0 days 00:00:04.866823,8,0.10214633373947096,8,0.0007176984494994998,Adam,8,97,COMPLETE
16,0.01024217065423727,2026-08-06 03:17:53.507113,2026-08-06 03:17:56.183694,0 days 00:00:02.676581,8,0.25420399927053894,13,0.00044503728886193043,Adam,32,25,COMPLETE
17,0.014595027081668377,2026-08-06 03:17:56.184067,2026-08-06 03:18:00.816043,0 days 00:00:04.631976,8,0.1978912781173434,8,0.00024423843071974213,RMSprop,32,89,COMPLETE
18,0.010282468982040882,2026-08-06 03:18:00.816427,2026-08-06 03:18:06.166345,0 days 00:00:05.349918,16,0.14420021889256585,13,0.0003690355151348262,RMSprop,8,118,COMPLETE
19,0.008232379332184792,2026-08-06 03:18:06.166712,2026-08-06 03:18:11.036926,0 days 00:00:04.870214,8,0.2791140949377836,4,0.0005448320064916077,Adam,16,87,COMPLETE
20,0.027334775775671005,2026-08-06 03:18:11.037655,2026-08-06 03:18:15.377324,0 days 00:00:04.339669,8,0.16213006112324055,13,0.0007637647577556518,RMSprop,32,43,COMPLETE
21,0.005871981848031282,2026-08-06 03:18:15.377754,2026-08-06 03:18:19.212034,0 days 00:00:03.834280,8,0.23248610447460868,13,0.0004224780867430255,RMSprop,32,45,COMPLETE
22,0.016879219561815262,2026-08-06 03:18:19.212410,2026-08-06 03:18:24.242163,0 days 00:00:05.029753,8,0.21735077508630304,13,0.0003486583733814401,RMSprop,32,64,COMPLETE
23,0.013205098919570446,2026-08-06 03:18:24.242530,2026-08-06 03:18:27.719694,0 days 00:00:03.477164,8,0.22559790910162608,13,0.0005911915109126798,RMSprop,32,40,COMPLETE
24,0.014348531141877174,2026-08-06 03:18:27.720170,2026-08-06 03:18:32.208301,0 days 00:00:04.488131,8,0.2688532924954564,13,0.00025386485576254884,RMSprop,32,55,COMPLETE
25,0.020369747653603554,2026-08-06 03:18:32.209007,2026-08-06 03:18:36.462505,0 days 00:00:04.253498,8,0.18801528939642792,8,0.00039769129726796815,RMSprop,8,86,COMPLETE
26,0.07584243267774582,2026-08-06 03:18:36.462889,2026-08-06 03:18:38.388372,0 days 00:00:01.925483,16,0.3015281071739425,13,0.00016018618678230955,Adam,32,20,COMPLETE
27,0.004803243093192577,2026-08-06 03:18:38.388758,2026-08-06 03:18:43.762513,0 days 00:00:05.373755,8,0.37261422921774423,13,0.0005017685615413685,RMSprop,32,68,COMPLETE
28,0.013807253912091255,2026-08-06 03:18:43.763010,2026-08-06 03:18:46.598932,0 days 00:00:02.835922,8,0.3839320732853826,13,0.0008487189645763143,RMSprop,32,30,COMPLETE
29,0.0074725341983139515,2026-08-06 03:18:46.599295,2026-08-06 03:18:49.648443,0 days 00:00:03.049148,16,0.3623153218443357,13,0.0005297631956314704,RMSprop,16,53,COMPLETE
30,0.006147598382085562,2026-08-06 03:18:49.648826,2026-08-06 03:18:53.957886,0 days 00:00:04.309060,8,0.3857553464947717,13,0.0006472574416562052,RMSprop,32,52,COMPLETE
31,0.011752634309232235,2026-08-06 03:18:53.958286,2026-08-06 03:18:57.743031,0 days 00:00:03.784745,8,0.3933178538078394,13,0.0006459987402417675,RMSprop,32,44,COMPLETE
32,0.010472595691680908,2026-08-06 03:18:57.743505,2026-08-06 03:19:01.144975,0 days 00:00:03.401470,8,0.4464545065867022,13,0.0009912577800610812,RMSprop,32,38,COMPLETE
33,0.010743518359959126,2026-08-06 03:19:01.145359,2026-08-06 03:19:07.258634,0 days 00:00:06.113275,8,0.3694185051227327,13,0.0004700814085219324,RMSprop,32,81,COMPLETE
34,0.011293173767626286,2026-08-06 03:19:07.259002,2026-08-06 03:19:09.745926,0 days 00:00:02.486924,16,0.33872513482011046,13,0.0008170766745308701,RMSprop,32,37,COMPLETE
35,0.01225622370839119,2026-08-06 03:19:09.746299,2026-08-06 03:19:14.149357,0 days 00:00:04.403058,8,0.3102110106984903,13,0.0006475645702318973,RMSprop,32,53,COMPLETE
36,0.009107090532779694,2026-08-06 03:19:14.149747,2026-08-06 03:19:17.269198,0 days 00:00:03.119451,8,0.2784959472499648,4,0.0005210694101217885,RMSprop,32,51,COMPLETE
37,0.011678212322294712,2026-08-06 03:19:17.269625,2026-08-06 03:19:23.101829,0 days 00:00:05.832204,8,0.4016410404669769,13,0.0006261884983105694,RMSprop,16,79,COMPLETE
38,0.03821738064289093,2026-08-06 03:19:23.102311,2026-08-06 03:19:26.115568,0 days 00:00:03.013257,16,0.3317210749069955,13,0.0007428178829006278,RMSprop,32,49,COMPLETE
39,0.006254356820136309,2026-08-06 03:19:26.116027,2026-08-06 03:19:28.531137,0 days 00:00:02.415110,8,0.35142890984675007,13,0.0008851554603221589,RMSprop,32,22,COMPLETE
40,0.017245445400476456,2026-08-06 03:19:28.531527,2026-08-06 03:19:31.546175,0 days 00:00:03.014648,8,0.41933066597256763,4,0.0005754404853916139,RMSprop,32,47,COMPLETE
41,0.009591527283191681,2026-08-06 03:19:31.546579,2026-08-06 03:19:34.922567,0 days 00:00:03.375988,8,0.35112130384316165,13,0.0009122009883215179,RMSprop,32,37,COMPLETE
42,0.012193162925541401,2026-08-06 03:19:34.922944,2026-08-06 03:19:37.764751,0 days 00:00:02.841807,8,0.3793342542290773,13,0.0008002809204991924,RMSprop,32,29,COMPLETE
43,0.0824192464351654,2026-08-06 03:19:37.765176,2026-08-06 03:19:39.757737,0 days 00:00:01.992561,8,0.3188201955156895,13,0.0007064440071434264,RMSprop,32,16,COMPLETE
44,0.02065437100827694,2026-08-06 03:19:39.758128,2026-08-06 03:19:42.813955,0 days 00:00:03.055827,8,0.350383023554267,13,0.0008962102612846229,RMSprop,32,32,COMPLETE
45,0.010364579036831856,2026-08-06 03:19:42.814358,2026-08-06 03:19:45.863766,0 days 00:00:03.049408,8,0.4043044641628475,13,0.0004981986247023339,RMSprop,32,32,COMPLETE
46,0.005393873434513807,2026-08-06 03:19:45.864127,2026-08-06 03:19:53.712818,0 days 00:00:07.848691,8,0.44257880584605713,13,0.0003194267315659222,RMSprop,32,107,COMPLETE
47,0.005793204065412283,2026-08-06 03:19:53.713219,2026-08-06 03:19:59.888386,0 days 00:00:06.175167,8,0.4430208121048146,13,0.0003346995181408225,RMSprop,16,84,COMPLETE
48,0.1118725836277008,2026-08-06 03:19:59.888935,2026-08-06 03:20:01.642744,0 days 00:00:01.753809,8,0.4432583177147866,4,0.0003078439659954004,RMSprop,16,16,COMPLETE
49,0.011517250910401344,2026-08-06 03:20:01.643139,2026-08-06 03:20:08.109466,0 days 00:00:06.466327,16,0.43588351135401376,13,0.0003464160917897325,RMSprop,16,144,COMPLETE
50,0.010210437700152397,2026-08-06 03:20:08.109860,2026-08-06 03:20:13.713459,0 days 00:00:05.603599,8,0.4306873341091834,8,0.00028409440446723226,RMSprop,16,115,COMPLETE
51,0.06944991648197174,2026-08-06 03:20:13.713916,2026-08-06 03:20:16.060697,0 days 00:00:02.346781,8,0.24123597496459181,13,0.00043576480420614986,RMSprop,16,16,COMPLETE
52,0.0069504049606621265,2026-08-06 03:20:16.061515,2026-08-06 03:20:22.675604,0 days 00:00:06.614089,8,0.402890818703941,13,0.0003730409762501443,RMSprop,16,74,COMPLETE
53,0.0073749045841395855,2026-08-06 03:20:22.676017,2026-08-06 03:20:29.260914,0 days 00:00:06.584897,8,0.41741380686383617,13,0.0003233642285824689,RMSprop,32,87,COMPLETE
54,0.030648348852992058,2026-08-06 03:20:29.261327,2026-08-06 03:20:34.258803,0 days 00:00:04.997476,8,0.20188304889899544,13,0.00042426540385734145,RMSprop,32,62,COMPLETE
55,0.007795298937708139,2026-08-06 03:20:34.259206,2026-08-06 03:20:44.705570,0 days 00:00:10.446364,8,0.17361117341819982,13,0.00022627967271427024,Adam,8,150,COMPLETE
56,0.04261486977338791,2026-08-06 03:20:44.705960,2026-08-06 03:20:51.383732,0 days 00:00:06.677772,8,0.2579294460054211,13,0.00018483779292451016,RMSprop,32,87,COMPLETE
57,0.03229573369026184,2026-08-06 03:20:51.384289,2026-08-06 03:20:54.609744,0 days 00:00:03.225455,8,0.22801676426020742,13,0.0002753567446112168,RMSprop,16,35,COMPLETE
58,0.01034923642873764,2026-08-06 03:20:54.610171,2026-08-06 03:21:05.605286,0 days 00:00:10.995115,8,0.42946063773898274,13,0.00046690731186730555,Adam,32,150,COMPLETE
59,0.009738059714436531,2026-08-06 03:21:05.605652,2026-08-06 03:21:08.602202,0 days 00:00:02.996550,8,0.4123698908122184,8,0.00038947550382482227,RMSprop,32,52,COMPLETE
60,0.011004879139363766,2026-08-06 03:21:08.602557,2026-08-06 03:21:13.356248,0 days 00:00:04.753691,8,0.3879293408271753,4,0.0003437591470999137,RMSprop,8,93,COMPLETE
61,0.018222695216536522,2026-08-06 03:21:13.356911,2026-08-06 03:21:16.062749,0 days 00:00:02.705838,8,0.3726220833484923,13,0.000987060027136296,RMSprop,32,27,COMPLETE
62,0.04666744917631149,2026-08-06 03:21:16.063151,2026-08-06 03:21:21.761389,0 days 00:00:05.698238,8,0.44719512023025454,13,0.0001072169740345529,RMSprop,32,75,COMPLETE
63,0.02024880424141884,2026-08-06 03:21:21.761753,2026-08-06 03:21:25.615513,0 days 00:00:03.853760,8,0.12493307362150913,13,0.0005632273549008235,RMSprop,32,46,COMPLETE
64,0.031471170485019684,2026-08-06 03:21:25.615867,2026-08-06 03:21:31.959474,0 days 00:00:06.343607,8,0.36293142483524277,13,0.00030765904289389634,RMSprop,32,84,COMPLETE
65,0.008861761540174484,2026-08-06 03:21:31.959840,2026-08-06 03:21:36.679107,0 days 00:00:04.719267,8,0.39918261851010695,13,0.0006723975428972964,RMSprop,32,60,COMPLETE
66,0.015315616503357887,2026-08-06 03:21:36.679646,2026-08-06 03:21:38.645302,0 days 00:00:01.965656,16,0.2947661191438053,13,0.0006019732746332646,RMSprop,32,24,COMPLETE
67,0.0067351567558944225,2026-08-06 03:21:38.645711,2026-08-06 03:21:42.253429,0 days 00:00:03.607718,8,0.4106472119041137,13,0.0007715624909703693,RMSprop,32,41,COMPLETE
68,0.012500880286097527,2026-08-06 03:21:42.253805,2026-08-06 03:21:45.652197,0 days 00:00:03.398392,8,0.32683262615185077,8,0.000927967439218179,Adam,16,59,COMPLETE
69,0.007044700905680656,2026-08-06 03:21:45.652569,2026-08-06 03:21:48.990182,0 days 00:00:03.337613,8,0.28753942874809235,13,0.0005035666729097943,RMSprop,32,37,COMPLETE
70,0.01073809340596199,2026-08-06 03:21:48.990567,2026-08-06 03:21:52.604234,0 days 00:00:03.613667,8,0.19533967028941632,13,0.0008472007263101819,RMSprop,8,43,COMPLETE
71,0.005073129199445248,2026-08-06 03:21:52.604727,2026-08-06 03:21:56.351270,0 days 00:00:03.746543,8,0.43790641124748014,13,0.000774069232745865,RMSprop,32,41,COMPLETE
72,0.12376964837312698,2026-08-06 03:21:56.351659,2026-08-06 03:21:58.386217,0 days 00:00:02.034558,8,0.42261239393431205,13,0.0002643532142745763,RMSprop,32,16,COMPLETE
73,0.017900779843330383,2026-08-06 03:21:58.386602,2026-08-06 03:22:00.402196,0 days 00:00:02.015594,8,0.43845725608509634,13,0.0007210836752054387,RMSprop,32,16,COMPLETE
74,0.004612855147570372,2026-08-06 03:22:00.402632,2026-08-06 03:22:04.666200,0 days 00:00:04.263568,8,0.42786553069965916,13,0.0008521082312354018,RMSprop,32,48,COMPLETE
