number,value,datetime_start,datetime_complete,duration,params_batch,params_dropout,params_lookback,params_lr,params_optimizer,params_units,user_attrs_epochs,state
0,0.00648106262087822,2026-08-06 03:53:05.595663,2026-08-06 03:53:11.671461,0 days 00:00:06.075798,8,0.18187345275873384,8,0.0006781499807349613,Adam,16,90,COMPLETE
1,0.0033420592080801725,2026-08-06 03:53:11.671833,2026-08-06 03:53:16.221577,0 days 00:00:04.549744,16,0.4498632523672612,8,0.0004344959707913307,RMSprop,8,106,COMPLETE
2,0.006128811277449131,2026-08-06 03:53:16.221935,2026-08-06 03:53:19.346397,0 days 00:00:03.124462,8,0.19683928520285116,13,0.0008228009531627572,RMSprop,8,44,COMPLETE
3,0.027886901050806046,2026-08-06 03:53:19.346759,2026-08-06 03:53:21.128243,0 days 00:00:01.781484,16,0.20486894523957452,8,0.00021890001458496345,Adam,8,21,COMPLETE
4,0.02235802821815014,2026-08-06 03:53:21.128609,2026-08-06 03:53:22.799997,0 days 00:00:01.671388,16,0.37479155574159445,4,0.00019951650194968449,RMSprop,16,23,COMPLETE
5,0.0033427453599870205,2026-08-06 03:53:22.800378,2026-08-06 03:53:25.095810,0 days 00:00:02.295432,16,0.39313213633248706,4,0.0008913081112161749,RMSprop,16,44,COMPLETE
6,0.007249482907354832,2026-08-06 03:53:25.096160,2026-08-06 03:53:29.394424,0 days 00:00:04.298264,8,0.2792353585002211,4,0.0005784735657905295,Adam,8,72,COMPLETE
7,0.0037571226712316275,2026-08-06 03:53:29.394905,2026-08-06 03:53:31.620426,0 days 00:00:02.225521,16,0.10748699652078345,13,0.0004970824646253722,Adam,32,32,COMPLETE
8,0.004314205143600702,2026-08-06 03:53:31.620940,2026-08-06 03:53:37.528452,0 days 00:00:05.907512,16,0.3727313194724516,4,0.00015541773582854228,Adam,8,150,COMPLETE
9,0.008661296218633652,2026-08-06 03:53:37.529067,2026-08-06 03:53:43.382618,0 days 00:00:05.853551,16,0.22694009496248102,13,0.00012958377360300523,Adam,16,133,COMPLETE
10,0.0038427459076046944,2026-08-06 03:53:43.382989,2026-08-06 03:53:48.007131,0 days 00:00:04.624142,8,0.44621679086039867,8,0.00041269606052177086,RMSprop,32,65,COMPLETE
11,0.003394932486116886,2026-08-06 03:53:48.007632,2026-08-06 03:53:52.437779,0 days 00:00:04.430147,16,0.4469597533069407,4,0.00030888143710310577,RMSprop,16,115,COMPLETE
12,0.006339136511087418,2026-08-06 03:53:52.438292,2026-08-06 03:53:55.132809,0 days 00:00:02.694517,16,0.3655503292223309,8,0.0009918309808287537,RMSprop,8,48,COMPLETE
13,0.007255001459270716,2026-08-06 03:53:55.133187,2026-08-06 03:54:00.290811,0 days 00:00:05.157624,16,0.3226303385383837,8,0.00034485621105541825,RMSprop,16,117,COMPLETE
14,0.004669989459216595,2026-08-06 03:54:00.291186,2026-08-06 03:54:02.580719,0 days 00:00:02.289533,16,0.41487108141168216,4,0.000703689859422414,RMSprop,32,41,COMPLETE
15,0.008259446360170841,2026-08-06 03:54:02.581114,2026-08-06 03:54:04.503552,0 days 00:00:01.922438,16,0.33033182583377,4,0.00025314247343411313,RMSprop,8,29,COMPLETE
16,0.01362339686602354,2026-08-06 03:54:04.503913,2026-08-06 03:54:06.060526,0 days 00:00:01.556613,16,0.4167120988104597,8,0.0005096574557893513,RMSprop,16,17,COMPLETE
17,0.004539056681096554,2026-08-06 03:54:06.060950,2026-08-06 03:54:09.029914,0 days 00:00:02.968964,16,0.3073268942388978,8,0.0009344852201435559,RMSprop,16,58,COMPLETE
18,0.003940045367926359,2026-08-06 03:54:09.030379,2026-08-06 03:54:12.964287,0 days 00:00:03.933908,8,0.40462097428288324,4,0.0004020991157363761,RMSprop,8,67,COMPLETE
19,0.005258633755147457,2026-08-06 03:54:12.964678,2026-08-06 03:54:14.945294,0 days 00:00:01.980616,16,0.3430142051751832,13,0.0006836403512381045,RMSprop,32,29,COMPLETE
20,0.004508239217102528,2026-08-06 03:54:14.945857,2026-08-06 03:54:18.417002,0 days 00:00:03.471145,16,0.26824537720343544,4,0.0003027416081058847,RMSprop,16,84,COMPLETE
21,0.005637401714920998,2026-08-06 03:54:18.417405,2026-08-06 03:54:23.163047,0 days 00:00:04.745642,16,0.44623338972154597,4,0.00010144485210497612,RMSprop,16,123,COMPLETE
22,0.002563242567703128,2026-08-06 03:54:23.163470,2026-08-06 03:54:26.864223,0 days 00:00:03.700753,16,0.44764616019022474,4,0.0002879993901064388,RMSprop,16,90,COMPLETE
23,0.002727137878537178,2026-08-06 03:54:26.864589,2026-08-06 03:54:31.669799,0 days 00:00:04.805210,16,0.39428152526743876,4,0.00025469066594506923,RMSprop,16,128,COMPLETE
24,0.0030944603495299816,2026-08-06 03:54:31.670247,2026-08-06 03:54:36.779753,0 days 00:00:05.109506,16,0.42233180993974484,4,0.0002564054315861479,RMSprop,16,137,COMPLETE
25,0.005651775281876326,2026-08-06 03:54:36.780117,2026-08-06 03:54:41.181987,0 days 00:00:04.401870,16,0.4061978214462845,4,0.00024870761223535565,RMSprop,16,114,COMPLETE
26,0.004419495817273855,2026-08-06 03:54:41.182537,2026-08-06 03:54:47.479338,0 days 00:00:06.296801,8,0.3557976277284596,4,0.00017453363799490993,RMSprop,16,119,COMPLETE
27,0.005451700650155544,2026-08-06 03:54:47.479759,2026-08-06 03:54:52.991355,0 days 00:00:05.511596,16,0.416155938692701,4,0.0002456151161224937,RMSprop,16,150,COMPLETE
28,0.005938371643424034,2026-08-06 03:54:52.991745,2026-08-06 03:54:56.830906,0 days 00:00:03.839161,16,0.3886717943547235,4,0.0002861488657626009,RMSprop,16,92,COMPLETE
29,0.002866070019081235,2026-08-06 03:54:56.831346,2026-08-06 03:55:00.977532,0 days 00:00:04.146186,8,0.4196701613801593,4,0.00036655653575651915,Adam,16,65,COMPLETE
30,0.007746363524347544,2026-08-06 03:55:00.977932,2026-08-06 03:55:04.783576,0 days 00:00:03.805644,8,0.12545861732088662,4,0.00035227166979507463,Adam,16,56,COMPLETE
31,0.00577508332207799,2026-08-06 03:55:04.783942,2026-08-06 03:55:10.309146,0 days 00:00:05.525204,8,0.429792422515117,4,0.00020791187502567046,Adam,16,89,COMPLETE
32,0.0038423750083893538,2026-08-06 03:55:10.309648,2026-08-06 03:55:18.293047,0 days 00:00:07.983399,8,0.4305554224786256,4,0.00027331083018712583,Adam,16,150,COMPLETE
33,0.004601066466420889,2026-08-06 03:55:18.293466,2026-08-06 03:55:22.532974,0 days 00:00:04.239508,8,0.38746399135549614,4,0.00035106685973026097,Adam,16,66,COMPLETE
34,0.003735416801646352,2026-08-06 03:55:22.533533,2026-08-06 03:55:31.911546,0 days 00:00:09.378013,8,0.42882762663793766,13,0.00019149379556122588,Adam,16,150,COMPLETE
35,0.005385729018598795,2026-08-06 03:55:31.911998,2026-08-06 03:55:34.631642,0 days 00:00:02.719644,8,0.16160908572300325,4,0.0003809336540672183,RMSprop,16,35,COMPLETE
36,0.004178687930107117,2026-08-06 03:55:34.632030,2026-08-06 03:55:39.671377,0 days 00:00:05.039347,16,0.38945894147713844,4,0.00022817280826210886,Adam,16,116,COMPLETE
37,0.004862192086875439,2026-08-06 03:55:39.672037,2026-08-06 03:55:44.282055,0 days 00:00:04.610018,16,0.3020512554616106,4,0.0004709981706477994,RMSprop,16,90,COMPLETE
38,0.0037256875075399876,2026-08-06 03:55:44.282581,2026-08-06 03:55:49.676074,0 days 00:00:05.393493,8,0.34618704213895624,4,0.00014380827779308337,Adam,32,90,COMPLETE
39,0.0034089600667357445,2026-08-06 03:55:49.676474,2026-08-06 03:55:54.551433,0 days 00:00:04.874959,16,0.37448302937930145,13,0.00018592343433796805,RMSprop,16,113,COMPLETE
40,0.003998240455985069,2026-08-06 03:55:54.551863,2026-08-06 03:55:58.887614,0 days 00:00:04.335751,16,0.24622989821381663,4,0.0005754196122469362,Adam,16,102,COMPLETE
41,0.003416087944060564,2026-08-06 03:55:58.888018,2026-08-06 03:56:02.998728,0 days 00:00:04.110710,16,0.43302469078378314,8,0.0004418423730388097,RMSprop,8,87,COMPLETE
42,0.003211543895304203,2026-08-06 03:56:02.999248,2026-08-06 03:56:07.549974,0 days 00:00:04.550726,16,0.40379679132239044,8,0.00032547705531374416,RMSprop,8,99,COMPLETE
43,0.005722647067159414,2026-08-06 03:56:07.550425,2026-08-06 03:56:11.867157,0 days 00:00:04.316732,16,0.3996956262063006,8,0.00032867064816601905,RMSprop,8,94,COMPLETE
44,0.0028746374882757664,2026-08-06 03:56:11.867564,2026-08-06 03:56:18.091608,0 days 00:00:06.224044,16,0.3786293314962373,8,0.0002702188927349069,RMSprop,8,150,COMPLETE
45,0.005914550740271807,2026-08-06 03:56:18.092088,2026-08-06 03:56:24.326099,0 days 00:00:06.234011,16,0.44926379407818673,8,0.0002769371919315746,RMSprop,8,150,COMPLETE
46,0.005014405120164156,2026-08-06 03:56:24.326698,2026-08-06 03:56:28.743086,0 days 00:00:04.416388,16,0.3641467032665835,4,0.0002265411421101941,RMSprop,32,111,COMPLETE
47,0.004092879127711058,2026-08-06 03:56:28.743485,2026-08-06 03:56:34.393339,0 days 00:00:05.649854,16,0.42449076947032144,13,0.0001696941527591081,RMSprop,8,144,COMPLETE
48,0.004164687357842922,2026-08-06 03:56:34.393752,2026-08-06 03:56:42.798321,0 days 00:00:08.404569,8,0.3803571678230445,8,0.0002662263561993267,Adam,16,133,COMPLETE
49,0.004384779371321201,2026-08-06 03:56:42.798692,2026-08-06 03:56:46.200128,0 days 00:00:03.401436,16,0.43739765260909547,4,0.0003782908548154067,RMSprop,16,81,COMPLETE
50,0.002684005768969655,2026-08-06 03:56:46.200472,2026-08-06 03:56:51.481514,0 days 00:00:05.281042,16,0.418367284333111,4,0.00021570318337720123,RMSprop,8,150,COMPLETE
51,0.003139875130727887,2026-08-06 03:56:51.481901,2026-08-06 03:56:56.869327,0 days 00:00:05.387426,16,0.4149482585551801,4,0.00023719375009870233,RMSprop,8,150,COMPLETE
52,0.003509440692141652,2026-08-06 03:56:56.869712,2026-08-06 03:57:02.053808,0 days 00:00:05.184096,16,0.397699092666178,4,0.0002995102726010248,RMSprop,8,145,COMPLETE
53,0.002965954365208745,2026-08-06 03:57:02.054481,2026-08-06 03:57:07.420434,0 days 00:00:05.365953,16,0.41676990137745307,4,0.0002081725843875405,RMSprop,8,150,COMPLETE
54,0.0035298680886626244,2026-08-06 03:57:07.420862,2026-08-06 03:57:10.920231,0 days 00:00:03.499369,16,0.3559282397712611,4,0.00021357629305960836,RMSprop,8,88,COMPLETE
55,0.004948645830154419,2026-08-06 03:57:10.920632,2026-08-06 03:57:16.962102,0 days 00:00:06.041470,16,0.37662973246362785,8,0.00020479561862232927,RMSprop,8,150,COMPLETE
56,0.004171546082943678,2026-08-06 03:57:16.962550,2026-08-06 03:57:22.251677,0 days 00:00:05.289127,16,0.409514984233604,4,0.00015438127653680177,RMSprop,8,150,COMPLETE
57,0.0034438075963407755,2026-08-06 03:57:22.252218,2026-08-06 03:57:27.592040,0 days 00:00:05.339822,16,0.43900057783827123,4,0.0003005650369933013,RMSprop,8,150,COMPLETE
58,0.00386813678778708,2026-08-06 03:57:27.592389,2026-08-06 03:57:33.410567,0 days 00:00:05.818178,16,0.31753394042104455,13,0.00018385839312754545,RMSprop,8,150,COMPLETE
59,0.00415822071954608,2026-08-06 03:57:33.410963,2026-08-06 03:57:41.168619,0 days 00:00:07.757656,8,0.3948961151763428,4,0.00022198039267872538,Adam,8,150,COMPLETE
60,0.0038136315997689962,2026-08-06 03:57:41.168977,2026-08-06 03:57:45.652351,0 days 00:00:04.483374,16,0.3368951745401303,8,0.00016596761900989019,RMSprop,32,92,COMPLETE
61,0.0036889284383505583,2026-08-06 03:57:45.653587,2026-08-06 04:03:46.683323,0 days 00:06:01.029736,16,0.4203035677530517,4,0.0002614505125508552,RMSprop,8,150,COMPLETE
62,0.00483597069978714,2026-08-06 04:03:46.684695,2026-08-06 04:03:54.354467,0 days 00:00:07.669772,16,0.4205151158111169,4,0.0002563647000141402,RMSprop,16,78,COMPLETE
63,0.0036123045720160007,2026-08-06 04:03:54.354841,2026-08-06 04:04:00.731703,0 days 00:00:06.376862,16,0.43801821615027636,4,0.00028700639935437126,RMSprop,16,100,COMPLETE
64,0.0035769606474786997,2026-08-06 04:04:00.732656,2026-08-06 04:04:07.840837,0 days 00:00:07.108181,16,0.4080613423070898,4,0.00024369780210554143,RMSprop,8,150,COMPLETE
65,0.004908342380076647,2026-08-06 04:04:07.841236,2026-08-06 04:04:13.876496,0 days 00:00:06.035260,16,0.4467874926780836,4,0.00019513599934472552,RMSprop,16,109,COMPLETE
66,0.003117161802947521,2026-08-06 04:04:13.876911,2026-08-06 04:04:21.258173,0 days 00:00:07.381262,16,0.384272434507679,4,0.0003229723614083264,RMSprop,16,150,COMPLETE
67,0.004109929781407118,2026-08-06 04:04:21.258563,2026-08-06 04:04:28.681787,0 days 00:00:07.423224,8,0.3692873541505831,4,0.0003690277251265684,RMSprop,8,108,COMPLETE
68,0.0043969424441456795,2026-08-06 04:04:28.682140,2026-08-06 04:04:36.301670,0 days 00:00:07.619530,16,0.4243512630370439,4,0.0001335649133540589,Adam,16,150,COMPLETE
69,0.009500320069491863,2026-08-06 04:04:36.302038,2026-08-06 04:04:41.119196,0 days 00:00:04.817158,16,0.20468131730201045,4,0.000415381734494214,RMSprop,32,70,COMPLETE
70,0.003579717129468918,2026-08-06 04:04:41.119559,2026-08-06 04:04:48.074064,0 days 00:00:06.954505,8,0.3561782276615312,4,0.0002318023257639213,RMSprop,16,95,COMPLETE
71,0.006041083484888077,2026-08-06 04:04:48.074445,2026-08-06 04:04:54.498001,0 days 00:00:06.423556,16,0.38594787425606997,4,0.00032662295061154206,RMSprop,16,121,COMPLETE
72,0.004818961024284363,2026-08-06 04:04:54.498382,2026-08-06 04:04:59.675814,0 days 00:00:05.177432,16,0.39674815463441526,4,0.0002935667477122628,RMSprop,16,85,COMPLETE
73,0.004817436449229717,2026-08-06 04:04:59.676183,2026-08-06 04:05:06.923876,0 days 00:00:07.247693,16,0.38174245839078574,4,0.00033714394745608915,RMSprop,16,139,COMPLETE
74,0.004328212235122919,2026-08-06 04:05:06.924424,2026-08-06 04:05:12.424125,0 days 00:00:05.499701,16,0.41757656577400193,4,0.00031100123724944366,RMSprop,16,95,COMPLETE
