number,value,datetime_start,datetime_complete,duration,params_batch,params_dropout,params_lookback,params_lr,params_optimizer,params_units,user_attrs_epochs,state
0,0.010029129683971405,2026-08-05 09:33:53.580604,2026-08-05 09:33:56.315876,0 days 00:00:02.735272,16,0.18123862624941678,13,0.0002065703609328178,RMSprop,8,56,COMPLETE
1,0.017016956582665443,2026-08-05 09:33:56.315899,2026-08-05 09:33:58.941299,0 days 00:00:02.625400,8,0.3328253672713631,4,0.00034433591987450445,Adam,16,47,COMPLETE
2,0.016177605837583542,2026-08-05 09:33:58.941325,2026-08-05 09:34:02.192666,0 days 00:00:03.251341,8,0.2887225865412579,13,0.0005610748971268033,RMSprop,32,41,COMPLETE
3,0.02564406394958496,2026-08-05 09:34:02.192692,2026-08-05 09:34:03.341811,0 days 00:00:01.149119,16,0.17575088805201275,4,0.00011170787933324295,RMSprop,16,17,COMPLETE
4,0.023830194026231766,2026-08-05 09:34:03.341842,2026-08-05 09:34:05.455988,0 days 00:00:02.114146,16,0.15563405980070077,8,0.0007973787942712488,Adam,8,54,COMPLETE
5,0.12116065621376038,2026-08-05 09:34:05.456013,2026-08-05 09:34:06.504679,0 days 00:00:01.048666,16,0.40349381121001465,8,0.0003116055109211731,Adam,16,16,COMPLETE
6,0.04082445055246353,2026-08-05 09:34:06.504706,2026-08-05 09:34:12.674324,0 days 00:00:06.169618,8,0.30882500378716377,8,0.0002608230668504288,RMSprop,32,127,COMPLETE
7,0.011407031677663326,2026-08-05 09:34:12.674360,2026-08-05 09:34:15.289552,0 days 00:00:02.615192,8,0.3146251666066312,8,0.0003441358263921027,RMSprop,16,48,COMPLETE
8,0.035818248987197876,2026-08-05 09:34:15.289578,2026-08-05 09:34:16.362461,0 days 00:00:01.072883,16,0.34841674323986077,8,0.00011937539627437903,RMSprop,32,16,COMPLETE
9,0.038984306156635284,2026-08-05 09:34:16.362491,2026-08-05 09:34:23.980052,0 days 00:00:07.617561,8,0.3468154415668779,13,0.0006334569396334389,Adam,8,110,COMPLETE
10,0.054201409220695496,2026-08-05 09:34:23.980081,2026-08-05 09:34:30.299326,0 days 00:00:06.319245,16,0.2203192893194136,13,0.00017045616764439344,RMSprop,8,150,COMPLETE
11,0.018753347918391228,2026-08-05 09:34:30.299352,2026-08-05 09:34:38.827257,0 days 00:00:08.527905,8,0.2319896693669059,13,0.0002161613177266509,RMSprop,16,127,COMPLETE
12,0.006150603294372559,2026-08-05 09:34:38.827288,2026-08-05 09:34:45.025960,0 days 00:00:06.198672,16,0.13146040576686185,8,0.00044102434848128233,RMSprop,8,81,COMPLETE
13,0.1704585999250412,2026-08-05 09:34:45.025992,2026-08-05 09:34:46.392650,0 days 00:00:01.366658,16,0.10228235674035367,13,0.0004623353887283825,RMSprop,8,16,COMPLETE
14,0.01009276695549488,2026-08-05 09:34:46.392676,2026-08-05 09:34:49.580059,0 days 00:00:03.187383,16,0.10178004333573355,4,0.00018774689728727386,RMSprop,8,84,COMPLETE
15,0.03205137699842453,2026-08-05 09:34:49.580086,2026-08-05 09:34:53.080193,0 days 00:00:03.500107,16,0.15907448090731494,8,0.0004472688287660729,RMSprop,8,107,COMPLETE
16,0.006466454826295376,2026-08-05 09:34:53.080224,2026-08-05 09:34:56.310004,0 days 00:00:03.229780,16,0.2311788315587921,13,0.0009535018051377441,RMSprop,8,66,COMPLETE
17,0.02080334536731243,2026-08-05 09:34:56.310031,2026-08-05 09:34:59.350164,0 days 00:00:03.040133,16,0.251200714135582,8,0.0009804096865937675,RMSprop,8,92,COMPLETE
18,0.018304111436009407,2026-08-05 09:34:59.350195,2026-08-05 09:35:04.880577,0 days 00:00:05.530382,16,0.19898418090424003,13,0.0007544168159192335,Adam,8,121,COMPLETE
19,0.03129120171070099,2026-08-05 09:35:04.880604,2026-08-05 09:35:07.786464,0 days 00:00:02.905860,16,0.1307513420008093,4,0.0009697250597575282,RMSprop,8,77,COMPLETE
20,0.012305710464715958,2026-08-05 09:35:07.786495,2026-08-05 09:35:11.037517,0 days 00:00:03.251022,16,0.4432291920122087,13,0.0004547530060574403,RMSprop,32,62,COMPLETE
21,0.012686967849731445,2026-08-05 09:35:11.037548,2026-08-05 09:35:17.639642,0 days 00:00:06.602094,16,0.18426453640832852,13,0.00015087794663119091,RMSprop,8,150,COMPLETE
22,0.020091164857149124,2026-08-05 09:35:17.639669,2026-08-05 09:35:24.037082,0 days 00:00:06.397413,16,0.14069173418286168,13,0.00024212458276204142,RMSprop,8,150,COMPLETE
23,0.054935600608587265,2026-08-05 09:35:24.037108,2026-08-05 09:35:30.781482,0 days 00:00:06.744374,16,0.20457704719007075,13,0.0002747997915756517,RMSprop,8,150,COMPLETE
24,0.013192890211939812,2026-08-05 09:35:30.781508,2026-08-05 09:35:37.724018,0 days 00:00:06.942510,16,0.26469652414655215,13,0.00038302869331193504,RMSprop,8,150,COMPLETE
25,0.007296768017113209,2026-08-05 09:35:37.724050,2026-08-05 09:35:40.984187,0 days 00:00:03.260137,16,0.23922819381168065,8,0.0005887768736128347,RMSprop,8,98,COMPLETE
26,0.020873844623565674,2026-08-05 09:35:40.984214,2026-08-05 09:35:45.881281,0 days 00:00:04.897067,16,0.237176738350209,8,0.0005964149092570228,Adam,8,150,COMPLETE
27,0.028949402272701263,2026-08-05 09:35:45.881308,2026-08-05 09:35:48.378899,0 days 00:00:02.497591,16,0.2772896477987034,8,0.0007564476436965961,RMSprop,8,73,COMPLETE
28,0.015344494953751564,2026-08-05 09:35:48.378923,2026-08-05 09:35:51.831946,0 days 00:00:03.453023,16,0.21228488177254362,8,0.0005068293185916684,RMSprop,8,107,COMPLETE
29,0.0058565749786794186,2026-08-05 09:35:51.831985,2026-08-05 09:35:54.367984,0 days 00:00:02.535999,16,0.38001344904383194,8,0.00068568595339395,RMSprop,32,66,COMPLETE
30,0.013220222666859627,2026-08-05 09:35:54.368010,2026-08-05 09:35:56.239060,0 days 00:00:01.871050,16,0.3816022932504555,8,0.0006886609064087843,RMSprop,32,44,COMPLETE
31,0.022190909832715988,2026-08-05 09:35:56.239085,2026-08-05 09:35:58.010297,0 days 00:00:01.771212,16,0.38716656227205126,8,0.0008041588545090355,RMSprop,32,41,COMPLETE
32,0.011125588789582253,2026-08-05 09:35:58.010324,2026-08-05 09:36:00.432708,0 days 00:00:02.422384,16,0.44712409047109014,8,0.0005323725109501651,RMSprop,32,62,COMPLETE
33,0.01692398637533188,2026-08-05 09:36:00.432734,2026-08-05 09:36:02.108208,0 days 00:00:01.675474,16,0.2966907278510385,8,0.0008756298569994249,RMSprop,32,37,COMPLETE
34,0.018608856946229935,2026-08-05 09:36:02.108236,2026-08-05 09:36:04.873498,0 days 00:00:02.765262,8,0.2545201064305254,4,0.0006553542950035369,RMSprop,32,45,COMPLETE
35,0.03995264694094658,2026-08-05 09:36:04.873531,2026-08-05 09:36:08.256984,0 days 00:00:03.383453,16,0.18211974024948874,8,0.0005743612267998407,Adam,16,97,COMPLETE
36,0.025260720402002335,2026-08-05 09:36:08.257020,2026-08-05 09:36:10.378367,0 days 00:00:02.121347,16,0.3246471377588962,8,0.00040910465321170335,RMSprop,8,55,COMPLETE
37,0.00808557216078043,2026-08-05 09:36:10.378394,2026-08-05 09:36:13.201433,0 days 00:00:02.823039,8,0.4186265704849716,4,0.0006806995154271746,RMSprop,32,45,COMPLETE
38,0.1339467465877533,2026-08-05 09:36:13.201461,2026-08-05 09:36:14.371559,0 days 00:00:01.170098,16,0.27938437766397667,8,0.0008678081619168717,Adam,16,17,COMPLETE
39,0.036182183772325516,2026-08-05 09:36:14.371591,2026-08-05 09:36:17.615321,0 days 00:00:03.243730,16,0.37128285425764396,8,0.0005372833845409206,RMSprop,8,99,COMPLETE
40,0.03725876659154892,2026-08-05 09:36:17.615350,2026-08-05 09:36:19.784423,0 days 00:00:02.169073,8,0.29952610136910024,8,0.0003257421581530572,RMSprop,32,38,COMPLETE
41,0.03380833566188812,2026-08-05 09:36:19.784451,2026-08-05 09:36:21.593439,0 days 00:00:01.808988,8,0.4074535650404485,4,0.0006885356865953179,RMSprop,32,27,COMPLETE
42,0.008271437138319016,2026-08-05 09:36:21.593471,2026-08-05 09:36:24.675431,0 days 00:00:03.081960,8,0.4209438263135018,4,0.0007176221634069711,RMSprop,32,57,COMPLETE
43,0.00948963314294815,2026-08-05 09:36:24.675457,2026-08-05 09:36:26.530489,0 days 00:00:01.855032,8,0.3615312363969677,4,0.0008759793425405215,RMSprop,32,28,COMPLETE
44,0.012196787633001804,2026-08-05 09:36:26.530516,2026-08-05 09:36:29.602531,0 days 00:00:03.072015,8,0.42874006542470783,4,0.0006038933241516726,RMSprop,32,50,COMPLETE
45,0.011959630064666271,2026-08-05 09:36:29.602565,2026-08-05 09:36:33.183116,0 days 00:00:03.580551,8,0.339422964119273,4,0.0003636332731148724,RMSprop,16,69,COMPLETE
46,0.014523178339004517,2026-08-05 09:36:33.183142,2026-08-05 09:36:36.360403,0 days 00:00:03.177261,8,0.22917404554980733,8,0.00047653842449959453,Adam,32,57,COMPLETE
47,0.011314804665744305,2026-08-05 09:36:36.360430,2026-08-05 09:36:39.838259,0 days 00:00:03.477829,16,0.4003722317490536,4,0.00042121008551635917,RMSprop,8,98,COMPLETE
48,0.012388685718178749,2026-08-05 09:36:39.838287,2026-08-05 09:36:42.943619,0 days 00:00:03.105332,16,0.16538399539447363,8,0.000813490055530739,RMSprop,8,92,COMPLETE
49,0.17845304310321808,2026-08-05 09:36:42.943646,2026-08-05 09:36:45.654943,0 days 00:00:02.711297,8,0.12747095521316476,13,0.0006335085660612363,RMSprop,32,33,COMPLETE
50,0.010168323293328285,2026-08-05 09:36:45.654972,2026-08-05 09:36:47.260308,0 days 00:00:01.605336,16,0.24895352346746252,8,0.0009873807303249318,RMSprop,8,42,COMPLETE
51,0.014566274359822273,2026-08-05 09:36:47.260336,2026-08-05 09:36:50.064351,0 days 00:00:02.804015,8,0.41892581748804614,4,0.000719525375922274,RMSprop,32,53,COMPLETE
52,0.014114456251263618,2026-08-05 09:36:50.064381,2026-08-05 09:36:52.251595,0 days 00:00:02.187214,8,0.431473174580962,4,0.0007325356397975839,RMSprop,32,33,COMPLETE
53,0.014248000457882881,2026-08-05 09:36:52.251634,2026-08-05 09:36:56.354471,0 days 00:00:04.102837,8,0.3984589681195135,4,0.0004987717062265413,RMSprop,32,79,COMPLETE
54,0.04067549854516983,2026-08-05 09:36:56.354502,2026-08-05 09:36:57.772069,0 days 00:00:01.417567,8,0.3560739556544868,4,0.0005515297179727701,RMSprop,32,16,COMPLETE
55,0.008676215074956417,2026-08-05 09:36:57.772097,2026-08-05 09:37:01.045499,0 days 00:00:03.273402,8,0.410866577884195,4,0.0006521291886211464,RMSprop,16,63,COMPLETE
56,0.0208060834556818,2026-08-05 09:37:01.045540,2026-08-05 09:37:07.506431,0 days 00:00:06.460891,16,0.42889564350691944,13,0.00010074686985891965,RMSprop,8,150,COMPLETE
57,0.007907464168965816,2026-08-05 09:37:07.506468,2026-08-05 09:37:09.146905,0 days 00:00:01.640437,8,0.319402905452178,4,0.0008410583376011391,Adam,32,19,COMPLETE
58,0.007011699490249157,2026-08-05 09:37:09.146931,2026-08-05 09:37:13.090607,0 days 00:00:03.943676,16,0.31797544239909886,13,0.0008145746667404263,Adam,8,83,COMPLETE
59,0.012574837543070316,2026-08-05 09:37:13.090634,2026-08-05 09:37:15.098124,0 days 00:00:02.007490,16,0.3235487526839199,13,0.0009104428998799769,Adam,8,33,COMPLETE
60,0.008103477768599987,2026-08-05 09:37:15.098150,2026-08-05 09:37:18.551427,0 days 00:00:03.453277,16,0.3129267183519443,13,0.0008057670904233715,Adam,8,68,COMPLETE
61,0.008040579035878181,2026-08-05 09:37:18.551453,2026-08-05 09:37:24.572712,0 days 00:00:06.021259,16,0.2874466418678051,13,0.0007788097245227373,Adam,8,134,COMPLETE
62,0.011958207935094833,2026-08-05 09:37:24.572743,2026-08-05 09:37:31.443957,0 days 00:00:06.871214,16,0.2945470949218996,13,0.0009025548419587337,Adam,8,150,COMPLETE
63,0.009879015386104584,2026-08-05 09:37:31.443988,2026-08-05 09:37:35.890658,0 days 00:00:04.446670,16,0.2830070392813353,13,0.0008021910537453968,Adam,8,94,COMPLETE
64,0.021214816719293594,2026-08-05 09:37:35.890686,2026-08-05 09:37:40.078117,0 days 00:00:04.187431,16,0.26445192331486617,13,0.0009972016305785324,Adam,8,88,COMPLETE
65,0.0052919029258191586,2026-08-05 09:37:40.078144,2026-08-05 09:37:43.984556,0 days 00:00:03.906412,16,0.33631808080778536,13,0.0007680804238487924,Adam,8,86,COMPLETE
66,0.09047840535640717,2026-08-05 09:37:43.984581,2026-08-05 09:37:45.274459,0 days 00:00:01.289878,16,0.3326249253222173,13,0.0005977239057047647,Adam,8,16,COMPLETE
67,0.012484883889555931,2026-08-05 09:37:45.274484,2026-08-05 09:37:52.034239,0 days 00:00:06.759755,16,0.36954181659912433,13,0.0008427650887859539,Adam,8,150,COMPLETE
68,0.07516762614250183,2026-08-05 09:37:52.034265,2026-08-05 09:37:57.654972,0 days 00:00:05.620707,16,0.19549662431897555,13,0.0009091773705808004,Adam,8,128,COMPLETE
69,0.012750428169965744,2026-08-05 09:37:57.654997,2026-08-05 09:38:01.009599,0 days 00:00:03.354602,16,0.3443159208288783,8,0.0007528501531360127,Adam,8,91,COMPLETE
70,0.02182774804532528,2026-08-05 09:38:01.009631,2026-08-05 09:38:05.677594,0 days 00:00:04.667963,16,0.30380076979087034,8,0.00013538588950050967,Adam,8,150,COMPLETE
71,0.020818471908569336,2026-08-05 09:38:05.677625,2026-08-05 09:38:12.107229,0 days 00:00:06.429604,16,0.32161855572399667,13,0.0007572653883366213,Adam,8,150,COMPLETE
72,0.013785929419100285,2026-08-05 09:38:12.107267,2026-08-05 09:38:18.714361,0 days 00:00:06.607094,16,0.28745955137599166,13,0.0009304091409350595,Adam,8,150,COMPLETE
73,0.019418690353631973,2026-08-05 09:38:18.714389,2026-08-05 09:38:25.478871,0 days 00:00:06.764482,16,0.2700110541521563,13,0.0002939750764784486,Adam,8,150,COMPLETE
74,0.006735682021826506,2026-08-05 09:38:25.478896,2026-08-05 09:38:30.284305,0 days 00:00:04.805409,16,0.11315220177435796,13,0.0006597707802325274,Adam,8,99,COMPLETE
