number,value,datetime_start,datetime_complete,duration,params_batch,params_dropout,params_lookback,params_lr,params_optimizer,params_units,user_attrs_epochs,state
0,0.019756365567445755,2026-08-05 11:12:47.256763,2026-08-05 11:12:52.597492,0 days 00:00:05.340729,8,0.22601914430216455,8,0.00026754646941831587,Adam,16,115,COMPLETE
1,0.014668013900518417,2026-08-05 11:12:52.597515,2026-08-05 11:12:55.225979,0 days 00:00:02.628464,16,0.28050982989837725,4,0.0003721235689852515,RMSprop,16,74,COMPLETE
2,0.01222607959061861,2026-08-05 11:12:55.226005,2026-08-05 11:12:57.901880,0 days 00:00:02.675875,8,0.3235988087999855,4,0.00014514031026210427,Adam,32,47,COMPLETE
3,0.057115428149700165,2026-08-05 11:12:57.901908,2026-08-05 11:13:00.378109,0 days 00:00:02.476201,16,0.3932029591093194,13,0.00016640439365687304,RMSprop,8,50,COMPLETE
4,0.04136897623538971,2026-08-05 11:13:00.378135,2026-08-05 11:13:02.768059,0 days 00:00:02.389924,16,0.2476744013022394,8,0.00011007051268353322,RMSprop,32,64,COMPLETE
5,0.024375377222895622,2026-08-05 11:13:02.768089,2026-08-05 11:13:04.311869,0 days 00:00:01.543780,16,0.21116387072596546,13,0.00021920298441687624,Adam,16,22,COMPLETE
6,0.04876459389925003,2026-08-05 11:13:04.311894,2026-08-05 11:13:10.908656,0 days 00:00:06.596762,8,0.35869701356068495,8,0.00021907162067707803,Adam,8,150,COMPLETE
7,0.014570661820471287,2026-08-05 11:13:10.908687,2026-08-05 11:13:15.805075,0 days 00:00:04.896388,16,0.20960415307974073,4,0.00036590480035425906,RMSprop,8,149,COMPLETE
8,0.01344987004995346,2026-08-05 11:13:15.805101,2026-08-05 11:13:18.873172,0 days 00:00:03.068071,8,0.4489223466994882,4,0.000887356535838832,RMSprop,8,57,COMPLETE
9,0.024246249347925186,2026-08-05 11:13:18.873202,2026-08-05 11:13:20.867603,0 days 00:00:01.994401,8,0.4115014467362579,4,0.0005232766891042847,Adam,8,29,COMPLETE
10,0.07334079593420029,2026-08-05 11:13:20.867643,2026-08-05 11:13:22.262627,0 days 00:00:01.394984,8,0.10264427338417437,4,0.00010465944773469283,Adam,32,16,COMPLETE
11,0.013473591767251492,2026-08-05 11:13:22.262656,2026-08-05 11:13:25.306802,0 days 00:00:03.044146,8,0.32649134381699424,4,0.0005665024493417124,RMSprop,32,59,COMPLETE
12,0.008813571184873581,2026-08-05 11:13:25.306830,2026-08-05 11:13:27.570240,0 days 00:00:02.263410,8,0.4300250730803431,4,0.0009781375126238414,RMSprop,32,40,COMPLETE
13,0.009421814233064651,2026-08-05 11:13:27.570266,2026-08-05 11:13:30.879432,0 days 00:00:03.309166,8,0.3274212732371218,4,0.0009574214596672497,Adam,32,61,COMPLETE
14,0.005611246917396784,2026-08-05 11:13:30.879457,2026-08-05 11:13:33.304264,0 days 00:00:02.424807,8,0.44787519565286193,13,0.000980022833381904,Adam,32,25,COMPLETE
15,0.006302386522293091,2026-08-05 11:13:33.304289,2026-08-05 11:13:38.134560,0 days 00:00:04.830271,8,0.4423584546977088,13,0.0006802226082653267,RMSprop,32,43,COMPLETE
16,0.0060641104355454445,2026-08-05 11:13:38.134585,2026-08-05 11:13:42.310185,0 days 00:00:04.175600,8,0.3806512940615509,13,0.0006757284997558329,Adam,32,48,COMPLETE
17,0.011040390469133854,2026-08-05 11:13:42.310213,2026-08-05 11:13:46.804708,0 days 00:00:04.494495,8,0.3785628818495128,13,0.0006577458837066883,Adam,32,55,COMPLETE
18,0.08184081315994263,2026-08-05 11:13:46.804734,2026-08-05 11:13:53.835812,0 days 00:00:07.031078,8,0.16053050645089015,13,0.00042241199767267834,Adam,32,91,COMPLETE
19,0.007675349712371826,2026-08-05 11:13:53.835841,2026-08-05 11:13:58.950289,0 days 00:00:05.114448,8,0.3623744846161082,13,0.00067349300393872,Adam,32,66,COMPLETE
20,0.0181294996291399,2026-08-05 11:13:58.950316,2026-08-05 11:14:01.358408,0 days 00:00:02.408092,8,0.40598050622087606,13,0.0007679653601472195,Adam,16,26,COMPLETE
21,0.038321517407894135,2026-08-05 11:14:01.358438,2026-08-05 11:14:04.848730,0 days 00:00:03.490292,8,0.4479167097095613,13,0.0004872856471675175,RMSprop,32,44,COMPLETE
22,0.019912680611014366,2026-08-05 11:14:04.848764,2026-08-05 11:14:08.215733,0 days 00:00:03.366969,8,0.41568628280439357,13,0.0007436082379247115,Adam,32,39,COMPLETE
23,0.009565260261297226,2026-08-05 11:14:08.215762,2026-08-05 11:14:11.635720,0 days 00:00:03.419958,8,0.4474597140349756,13,0.0006208957422153131,RMSprop,32,43,COMPLETE
24,0.04103320464491844,2026-08-05 11:14:11.635750,2026-08-05 11:14:17.301844,0 days 00:00:05.666094,8,0.3745077397876537,13,0.0008307416944443667,Adam,32,73,COMPLETE
25,0.008063697256147861,2026-08-05 11:14:17.301870,2026-08-05 11:14:23.256658,0 days 00:00:05.954788,8,0.3466381209429882,13,0.0004928070810557532,Adam,32,76,COMPLETE
26,0.013907383196055889,2026-08-05 11:14:23.256684,2026-08-05 11:14:25.582480,0 days 00:00:02.325796,16,0.4202953684887699,13,0.0007555598976421971,RMSprop,32,42,COMPLETE
27,0.030407266691327095,2026-08-05 11:14:25.582506,2026-08-05 11:14:27.933357,0 days 00:00:02.350851,8,0.2966148336310061,13,0.0002992206442019829,Adam,32,24,COMPLETE
28,0.008697670884430408,2026-08-05 11:14:27.933389,2026-08-05 11:14:31.602270,0 days 00:00:03.668881,8,0.39077750756705376,8,0.00041399410461052564,RMSprop,32,74,COMPLETE
29,0.009029202163219452,2026-08-05 11:14:31.602299,2026-08-05 11:14:34.685570,0 days 00:00:03.083271,8,0.43035731514117587,8,0.0009926522553063975,Adam,16,60,COMPLETE
30,0.005621830467134714,2026-08-05 11:14:34.685595,2026-08-05 11:14:41.710076,0 days 00:00:07.024481,8,0.3993442398900176,13,0.0005951234335672076,Adam,16,99,COMPLETE
31,0.033525627106428146,2026-08-05 11:14:41.710109,2026-08-05 11:14:46.720080,0 days 00:00:05.009971,8,0.3957699523381847,13,0.0005916860846109565,Adam,16,67,COMPLETE
32,0.0143001489341259,2026-08-05 11:14:46.720105,2026-08-05 11:14:49.765699,0 days 00:00:03.045594,8,0.42706216642934686,13,0.0006852178642746149,Adam,16,37,COMPLETE
33,0.010554617270827293,2026-08-05 11:14:49.765725,2026-08-05 11:14:53.389286,0 days 00:00:03.623561,8,0.30599932888903014,13,0.00078278503967025,Adam,16,45,COMPLETE
34,0.03220575302839279,2026-08-05 11:14:53.389314,2026-08-05 11:14:58.161613,0 days 00:00:04.772299,16,0.3462078346530817,13,0.0004379508964050544,Adam,16,103,COMPLETE
35,0.026621554046869278,2026-08-05 11:14:58.161641,2026-08-05 11:14:59.995704,0 days 00:00:01.834063,8,0.39243623090262586,13,0.0008671521377664845,Adam,16,18,COMPLETE
36,0.00949140265583992,2026-08-05 11:14:59.995730,2026-08-05 11:15:04.182775,0 days 00:00:04.187045,16,0.27504535262381613,13,0.0005638834769730565,RMSprop,16,88,COMPLETE
37,0.006590187083929777,2026-08-05 11:15:04.182802,2026-08-05 11:15:07.885894,0 days 00:00:03.703092,8,0.3759256764862694,8,0.0006926113317254553,Adam,32,65,COMPLETE
38,0.009015500545501709,2026-08-05 11:15:07.885921,2026-08-05 11:15:15.000424,0 days 00:00:07.114503,8,0.24601286962018387,13,0.0003598366542662466,RMSprop,8,102,COMPLETE
39,0.022321198135614395,2026-08-05 11:15:15.000456,2026-08-05 11:15:18.811264,0 days 00:00:03.810808,16,0.4378738388025432,13,0.0001505721720841887,Adam,32,75,COMPLETE
40,0.013479091227054596,2026-08-05 11:15:18.811301,2026-08-05 11:15:25.235339,0 days 00:00:06.424038,8,0.4054944990433701,8,0.0001967207343016906,RMSprop,8,149,COMPLETE
41,0.006393414922058582,2026-08-05 11:15:25.235365,2026-08-05 11:15:27.259732,0 days 00:00:02.024367,8,0.36844850246144184,8,0.0006961237788575427,Adam,32,34,COMPLETE
42,0.015627246350049973,2026-08-05 11:15:27.259757,2026-08-05 11:15:30.793848,0 days 00:00:03.534091,8,0.3527179773023258,8,0.0008911449468003535,Adam,32,69,COMPLETE
43,0.00846916064620018,2026-08-05 11:15:30.793873,2026-08-05 11:15:33.586709,0 days 00:00:02.792836,8,0.3832226086129514,8,0.0005456259647213433,Adam,32,52,COMPLETE
44,0.008367655798792839,2026-08-05 11:15:33.586742,2026-08-05 11:15:36.186673,0 days 00:00:02.599931,8,0.4105677384616248,8,0.0006122126544084759,Adam,32,47,COMPLETE
45,0.017753418534994125,2026-08-05 11:15:36.186706,2026-08-05 11:15:38.859580,0 days 00:00:02.672874,8,0.36654123895835644,8,0.00048529664417137913,Adam,32,49,COMPLETE
46,0.046908456832170486,2026-08-05 11:15:38.859605,2026-08-05 11:15:44.953209,0 days 00:00:06.093604,8,0.3377435304415968,13,0.0001233842784447486,Adam,32,83,COMPLETE
47,0.011262115091085434,2026-08-05 11:15:44.953235,2026-08-05 11:15:47.970483,0 days 00:00:03.017248,16,0.3132173972344658,13,0.0008265452463390454,RMSprop,8,65,COMPLETE
48,0.006109523121267557,2026-08-05 11:15:47.970509,2026-08-05 11:15:51.686856,0 days 00:00:03.716347,8,0.432728021891281,4,0.0007017793667442593,Adam,16,74,COMPLETE
49,0.008823322132229805,2026-08-05 11:15:51.686881,2026-08-05 11:15:57.454231,0 days 00:00:05.767350,8,0.4351388893258775,4,0.00026827032879092036,Adam,16,123,COMPLETE
50,0.01321633905172348,2026-08-05 11:15:57.454263,2026-08-05 11:16:00.222207,0 days 00:00:02.767944,8,0.4196814228889684,4,0.000912927499169117,RMSprop,16,53,COMPLETE
51,0.011080474592745304,2026-08-05 11:16:00.222231,2026-08-05 11:16:03.995229,0 days 00:00:03.772998,8,0.4499992897130172,4,0.0007088557793678827,Adam,16,76,COMPLETE
52,0.007653404492884874,2026-08-05 11:16:03.995258,2026-08-05 11:16:07.151579,0 days 00:00:03.156321,8,0.4012387642882666,4,0.0006374616235035648,Adam,16,59,COMPLETE
53,0.008472533896565437,2026-08-05 11:16:07.151609,2026-08-05 11:16:09.873399,0 days 00:00:02.721790,8,0.17343705926899794,4,0.0008009290937438389,Adam,32,48,COMPLETE
54,0.037075143307447433,2026-08-05 11:16:09.873426,2026-08-05 11:16:11.548428,0 days 00:00:01.675002,8,0.43336991186291324,13,0.0005314036527828888,Adam,16,16,COMPLETE
55,0.014471773989498615,2026-08-05 11:16:11.548453,2026-08-05 11:16:14.089024,0 days 00:00:02.540571,8,0.4172080601174551,4,0.0006394977083782659,Adam,32,44,COMPLETE
56,0.006208525970578194,2026-08-05 11:16:14.089049,2026-08-05 11:16:21.863749,0 days 00:00:07.774700,8,0.3872696035297005,13,0.0004529911582656016,Adam,32,109,COMPLETE
57,0.009873617440462112,2026-08-05 11:16:21.863775,2026-08-05 11:16:31.455954,0 days 00:00:09.592179,8,0.3858969008871832,13,0.0003890307422607204,Adam,8,147,COMPLETE
58,0.005019121803343296,2026-08-05 11:16:31.455984,2026-08-05 11:16:35.841233,0 days 00:00:04.385249,8,0.4004416395401171,13,0.0004782027516431861,RMSprop,32,60,COMPLETE
59,0.006179440766572952,2026-08-05 11:16:35.841260,2026-08-05 11:16:40.421489,0 days 00:00:04.580229,16,0.40011757074065524,13,0.0003370286531680418,Adam,32,95,COMPLETE
60,0.027743278071284294,2026-08-05 11:16:40.421514,2026-08-05 11:16:44.809311,0 days 00:00:04.387797,16,0.4020801149983292,13,0.00033663523170620897,RMSprop,16,100,COMPLETE
61,0.015393717214465141,2026-08-05 11:16:44.809337,2026-08-05 11:16:46.494211,0 days 00:00:01.684874,16,0.4227229189030364,13,0.0004580966777931983,Adam,32,25,COMPLETE
62,0.050645846873521805,2026-08-05 11:16:46.494240,2026-08-05 11:16:47.904803,0 days 00:00:01.410563,16,0.3855698406914158,13,0.0003080167443306682,Adam,32,18,COMPLETE
63,0.026830650866031647,2026-08-05 11:16:47.904831,2026-08-05 11:16:50.640959,0 days 00:00:02.736128,16,0.4070516950801897,13,0.0003876846808600079,Adam,32,50,COMPLETE
64,0.07863332331180573,2026-08-05 11:16:50.640988,2026-08-05 11:16:54.316390,0 days 00:00:03.675402,16,0.36131176038912044,13,0.00045582599554501327,Adam,32,36,COMPLETE
65,0.009469244629144669,2026-08-05 11:16:54.316416,2026-08-05 11:16:57.925938,0 days 00:00:03.609522,8,0.39600172714009974,13,0.0005121128977639724,Adam,32,43,COMPLETE
66,0.022289838641881943,2026-08-05 11:16:57.925962,2026-08-05 11:17:02.256380,0 days 00:00:04.330418,8,0.3339688500483505,13,0.0005866210304880864,Adam,32,54,COMPLETE
67,0.01981683075428009,2026-08-05 11:17:02.256415,2026-08-05 11:17:08.187782,0 days 00:00:05.931367,8,0.11399335903800903,13,0.0002288044980306642,Adam,32,77,COMPLETE
68,0.02093915082514286,2026-08-05 11:17:08.187807,2026-08-05 11:17:10.475015,0 days 00:00:02.287208,16,0.42800696901194785,13,0.0004139195228170034,Adam,16,40,COMPLETE
69,0.012544477358460426,2026-08-05 11:17:10.475041,2026-08-05 11:17:13.584747,0 days 00:00:03.109706,8,0.2608600586189072,13,0.0003454504397569389,RMSprop,32,38,COMPLETE
70,0.023957742378115654,2026-08-05 11:17:13.584774,2026-08-05 11:17:16.252803,0 days 00:00:02.668029,8,0.44349064252472803,13,0.0002747778674498994,Adam,32,29,COMPLETE
71,0.011388786137104034,2026-08-05 11:17:16.252828,2026-08-05 11:17:19.434352,0 days 00:00:03.181524,8,0.4386455237641268,13,0.0007292503375973151,RMSprop,32,39,COMPLETE
72,0.040667012333869934,2026-08-05 11:17:19.434378,2026-08-05 11:17:22.972446,0 days 00:00:03.538068,8,0.4150489251374106,13,0.0005768378151269751,RMSprop,32,45,COMPLETE
73,0.011744600720703602,2026-08-05 11:17:22.972473,2026-08-05 11:17:25.991628,0 days 00:00:03.019155,8,0.37226314731306875,13,0.000941348104710582,RMSprop,32,38,COMPLETE
74,0.008024857379496098,2026-08-05 11:17:25.991658,2026-08-05 11:17:29.917553,0 days 00:00:03.925895,8,0.42438466258925095,13,0.0005122227831733179,RMSprop,32,51,COMPLETE
