number,value,datetime_start,datetime_complete,duration,params_batch,params_dropout,params_lookback,params_lr,params_optimizer,params_units,user_attrs_epochs,state
0,0.0032612988725304604,2026-08-05 14:46:14.246078,2026-08-05 14:46:17.634004,0 days 00:00:03.387926,16,0.4374969035824493,4,0.0008543325964331789,Adam,16,67,COMPLETE
1,0.004557308740913868,2026-08-05 14:46:17.634050,2026-08-05 14:46:24.391728,0 days 00:00:06.757678,8,0.21989212163613955,13,0.0003456182640829222,RMSprop,8,106,COMPLETE
2,0.0038599283434450626,2026-08-05 14:46:24.391762,2026-08-05 14:46:30.028536,0 days 00:00:05.636774,16,0.3657918012895464,4,0.00023862646443618198,RMSprop,16,150,COMPLETE
3,0.005044765304774046,2026-08-05 14:46:30.028569,2026-08-05 14:46:34.911741,0 days 00:00:04.883172,16,0.1961474712142607,4,0.0004265770352830082,RMSprop,8,113,COMPLETE
4,0.012851179577410221,2026-08-05 14:46:34.911774,2026-08-05 14:46:41.848114,0 days 00:00:06.936340,16,0.2907136426391975,13,0.00011002116640572023,Adam,16,150,COMPLETE
5,0.009048843756318092,2026-08-05 14:46:41.848153,2026-08-05 14:46:48.362807,0 days 00:00:06.514654,16,0.18291293381611395,13,0.00011166015735372803,RMSprop,8,150,COMPLETE
6,0.02508390136063099,2026-08-05 14:46:48.362835,2026-08-05 14:46:50.164628,0 days 00:00:01.801793,8,0.23155459445882057,13,0.0001639452521837645,Adam,8,16,COMPLETE
7,0.004321824759244919,2026-08-05 14:46:50.164656,2026-08-05 14:46:52.442689,0 days 00:00:02.278033,16,0.27197546654730415,8,0.0009299114795021346,RMSprop,16,40,COMPLETE
8,0.0032698647119104862,2026-08-05 14:46:52.442725,2026-08-05 14:46:58.004500,0 days 00:00:05.561775,8,0.44487159337490273,8,0.000253302631212141,Adam,32,74,COMPLETE
9,0.009491208009421825,2026-08-05 14:46:58.004530,2026-08-05 14:47:03.674127,0 days 00:00:05.669597,16,0.10604167919480535,4,0.00016778466145468695,Adam,8,150,COMPLETE
10,0.003364179516211152,2026-08-05 14:47:03.674160,2026-08-05 14:47:06.648757,0 days 00:00:02.974597,8,0.41455392864535734,4,0.000982322928926537,Adam,32,42,COMPLETE
11,0.004162042401731014,2026-08-05 14:47:06.648791,2026-08-05 14:47:09.788854,0 days 00:00:03.140063,8,0.4462007413074076,8,0.0005357609336110748,Adam,32,35,COMPLETE
12,0.004525529220700264,2026-08-05 14:47:09.788889,2026-08-05 14:47:14.458147,0 days 00:00:04.669258,8,0.3674104147674789,8,0.000622990322891816,Adam,32,54,COMPLETE
13,0.0036545945331454277,2026-08-05 14:47:14.458190,2026-08-05 14:47:19.295425,0 days 00:00:04.837235,8,0.3800208062929821,8,0.00025402097124060935,Adam,32,59,COMPLETE
14,0.0031733131036162376,2026-08-05 14:47:19.295474,2026-08-05 14:47:22.913333,0 days 00:00:03.617859,16,0.4447309678114552,4,0.0006503640395963124,Adam,16,78,COMPLETE
15,0.0047418903559446335,2026-08-05 14:47:22.913363,2026-08-05 14:47:26.413577,0 days 00:00:03.500214,16,0.33798963593149073,4,0.0007057494103766139,Adam,16,76,COMPLETE
16,0.004498633090406656,2026-08-05 14:47:26.413603,2026-08-05 14:47:29.939495,0 days 00:00:03.525892,16,0.31451254218349023,4,0.0007705223481331055,Adam,16,74,COMPLETE
17,0.006593272555619478,2026-08-05 14:47:29.939532,2026-08-05 14:47:35.928949,0 days 00:00:05.989417,16,0.40831387012425435,4,0.0004879950241845473,Adam,16,146,COMPLETE
18,0.005532596725970507,2026-08-05 14:47:35.928978,2026-08-05 14:47:48.142079,0 days 00:00:12.213101,16,0.412639276500792,4,0.0003850197225445815,Adam,16,150,COMPLETE
19,0.004469653591513634,2026-08-05 14:47:48.142329,2026-08-05 14:47:51.246988,0 days 00:00:03.104659,16,0.33644165552283245,4,0.0005838716796272756,Adam,16,49,COMPLETE
20,0.00703765032812953,2026-08-05 14:47:51.247020,2026-08-05 14:47:54.062460,0 days 00:00:02.815440,16,0.12154702562209452,4,0.0007436393843197945,Adam,16,52,COMPLETE
21,0.004378828685730696,2026-08-05 14:47:54.062493,2026-08-05 14:48:00.789915,0 days 00:00:06.727422,8,0.447625853641495,8,0.000263415420382182,Adam,32,91,COMPLETE
22,0.003966660238802433,2026-08-05 14:48:00.789944,2026-08-05 14:48:08.014189,0 days 00:00:07.224245,8,0.44839880770847285,8,0.0001929902153971482,Adam,32,97,COMPLETE
23,0.00570153072476387,2026-08-05 14:48:08.014213,2026-08-05 14:48:16.316651,0 days 00:00:08.302438,8,0.3978625943316103,8,0.0002921576983571479,Adam,16,123,COMPLETE
24,0.005857431795448065,2026-08-05 14:48:16.316708,2026-08-05 14:48:32.527366,0 days 00:00:16.210658,16,0.42711773918661655,4,0.0008438109493463431,Adam,32,40,COMPLETE
25,0.004384117666631937,2026-08-05 14:48:32.527495,2026-08-05 14:48:38.623786,0 days 00:00:06.096291,16,0.3879972591948779,8,0.000448404839345559,Adam,16,100,COMPLETE
26,0.0052490863017737865,2026-08-05 14:48:38.623815,2026-08-05 14:48:43.455174,0 days 00:00:04.831359,8,0.3567188622744208,4,0.0003367830471679738,RMSprop,32,69,COMPLETE
27,0.004773900378495455,2026-08-05 14:48:43.455203,2026-08-05 14:48:48.843808,0 days 00:00:05.388605,16,0.41725122582029833,4,0.0006560969240313913,Adam,16,120,COMPLETE
28,0.011630193330347538,2026-08-05 14:48:48.843835,2026-08-05 14:48:56.280819,0 days 00:00:07.436984,8,0.43213197905340994,13,0.0005344241616570881,Adam,16,97,COMPLETE
29,0.004414849914610386,2026-08-05 14:48:56.280862,2026-08-05 14:49:03.036924,0 days 00:00:06.756062,8,0.39498454984384856,8,0.00019974848340854922,RMSprop,32,78,COMPLETE
30,0.004771752282977104,2026-08-05 14:49:03.036964,2026-08-05 14:49:10.772105,0 days 00:00:07.735141,16,0.33590958577674934,13,0.0003859045301040671,Adam,8,150,COMPLETE
31,0.004296998959034681,2026-08-05 14:49:10.772142,2026-08-05 14:49:13.752801,0 days 00:00:02.980659,8,0.4169536937641928,4,0.0009803535463966222,Adam,32,33,COMPLETE
32,0.00402652146294713,2026-08-05 14:49:13.752829,2026-08-05 14:49:17.422135,0 days 00:00:03.669306,8,0.4476376370705195,4,0.0008434244350350846,Adam,32,44,COMPLETE
33,0.004175653215497732,2026-08-05 14:49:17.422176,2026-08-05 14:49:20.809641,0 days 00:00:03.387465,8,0.4280055197506192,4,0.0009517510234541601,Adam,32,41,COMPLETE
34,0.005123831331729889,2026-08-05 14:49:20.809676,2026-08-05 14:49:23.790093,0 days 00:00:02.980417,8,0.3597149259769573,4,0.0008585118071991292,RMSprop,32,36,COMPLETE
35,0.004797095432877541,2026-08-05 14:49:23.790132,2026-08-05 14:49:28.239723,0 days 00:00:04.449591,8,0.3809788192517301,4,0.0007296692458426546,Adam,16,66,COMPLETE
36,0.004206502344459295,2026-08-05 14:49:28.239759,2026-08-05 14:49:34.486485,0 days 00:00:06.246726,16,0.40489578261699893,4,0.00021565930657687008,RMSprop,8,150,COMPLETE
37,0.00657067121937871,2026-08-05 14:49:34.486525,2026-08-05 14:49:38.555280,0 days 00:00:04.068755,16,0.25733658484361227,13,0.00031139975910113933,Adam,32,69,COMPLETE
38,0.0037188520655035973,2026-08-05 14:49:38.555315,2026-08-05 14:49:41.984925,0 days 00:00:03.429610,8,0.30319140492951446,4,0.000985389385521936,Adam,16,50,COMPLETE
39,0.01041619386523962,2026-08-05 14:49:41.984952,2026-08-05 14:49:48.960657,0 days 00:00:06.975705,16,0.2091771642604219,8,0.0001331062860315111,RMSprop,8,150,COMPLETE
40,0.0031954001169651747,2026-08-05 14:49:48.960689,2026-08-05 14:49:53.281528,0 days 00:00:04.320839,8,0.43083101441180877,13,0.000644251448807924,Adam,32,47,COMPLETE
41,0.0022298647090792656,2026-08-05 14:49:53.281568,2026-08-05 14:49:56.536427,0 days 00:00:03.254859,8,0.4336396684359368,13,0.0006449347182615372,Adam,32,33,COMPLETE
42,0.00500127486884594,2026-08-05 14:49:56.536454,2026-08-05 14:50:01.661497,0 days 00:00:05.125043,8,0.43120945775359915,13,0.0005738475333527891,Adam,32,60,COMPLETE
43,0.009659050032496452,2026-08-05 14:50:01.661547,2026-08-05 14:50:03.712690,0 days 00:00:02.051143,8,0.4312264204378472,13,0.0006563543121523852,Adam,32,17,COMPLETE
44,0.004593060351908207,2026-08-05 14:50:03.712723,2026-08-05 14:50:07.691558,0 days 00:00:03.978835,8,0.15036088870000053,13,0.00047429564986374204,Adam,32,48,COMPLETE
45,0.003336497815325856,2026-08-05 14:50:07.691599,2026-08-05 14:50:10.845059,0 days 00:00:03.153460,8,0.3767388320188554,13,0.0005275901959798402,Adam,32,36,COMPLETE
46,0.0058878157287836075,2026-08-05 14:50:10.845086,2026-08-05 14:50:17.523650,0 days 00:00:06.678564,16,0.39609352775234563,13,0.0008003225342278729,Adam,16,150,COMPLETE
47,0.0021601615007966757,2026-08-05 14:50:17.523683,2026-08-05 14:50:21.829084,0 days 00:00:04.305401,8,0.43572091953613595,13,0.0006331684184406324,Adam,8,58,COMPLETE
48,0.0035434430465102196,2026-08-05 14:50:21.829137,2026-08-05 14:50:29.119069,0 days 00:00:07.289932,8,0.43584047705039763,13,0.0006852094152638032,Adam,8,109,COMPLETE
49,0.002936075208708644,2026-08-05 14:50:29.119099,2026-08-05 14:50:34.053310,0 days 00:00:04.934211,16,0.4106762619852223,13,0.00040767330773234346,Adam,8,110,COMPLETE
50,0.003674532985314727,2026-08-05 14:50:34.053337,2026-08-05 14:50:40.546148,0 days 00:00:06.492811,16,0.2388062760210589,13,0.00040439532122079366,Adam,8,147,COMPLETE
51,0.0037274169735610485,2026-08-05 14:50:40.546176,2026-08-05 14:50:47.664742,0 days 00:00:07.118566,16,0.4184582741661367,13,0.0005908005114733639,Adam,8,150,COMPLETE
52,0.016192959621548653,2026-08-05 14:50:47.664782,2026-08-05 14:50:53.996533,0 days 00:00:06.331751,16,0.4051744270327181,13,0.0006171466128200756,Adam,8,131,COMPLETE
53,0.004464446101337671,2026-08-05 14:50:53.996575,2026-08-05 14:51:01.034874,0 days 00:00:07.038299,16,0.4370756297214369,13,0.0005124307584548696,Adam,8,150,COMPLETE
54,0.0037396508269011974,2026-08-05 14:51:01.034913,2026-08-05 14:51:07.652632,0 days 00:00:06.617719,16,0.41698578400177133,13,0.00043409001626351325,Adam,8,150,COMPLETE
55,0.00627231365069747,2026-08-05 14:51:07.652679,2026-08-05 14:51:14.118686,0 days 00:00:06.466007,16,0.4475950292665962,13,0.0007743222645111067,Adam,8,150,COMPLETE
56,0.0029538199305534363,2026-08-05 14:51:14.118715,2026-08-05 14:51:19.202255,0 days 00:00:05.083540,8,0.391124641257971,13,0.0008971895610668034,Adam,8,74,COMPLETE
57,0.003099511144682765,2026-08-05 14:51:19.202281,2026-08-05 14:51:24.563141,0 days 00:00:05.360860,8,0.347582921164894,13,0.0008907391740263942,Adam,8,78,COMPLETE
58,0.005225059576332569,2026-08-05 14:51:24.563174,2026-08-05 14:51:29.669809,0 days 00:00:05.106635,8,0.35206331854994927,13,0.0008498377583732337,Adam,8,74,COMPLETE
59,0.0024519930593669415,2026-08-05 14:51:29.669842,2026-08-05 14:51:32.200060,0 days 00:00:02.530218,8,0.37297712714156755,13,0.000900288044161045,RMSprop,8,30,COMPLETE
60,0.002067043911665678,2026-08-05 14:51:32.200088,2026-08-05 14:51:35.410103,0 days 00:00:03.210015,8,0.3729462406851336,13,0.0008719443118094684,RMSprop,8,43,COMPLETE
61,0.003658824600279331,2026-08-05 14:51:35.410132,2026-08-05 14:51:38.994042,0 days 00:00:03.583910,8,0.3709867009077597,13,0.0008949242197278277,RMSprop,8,52,COMPLETE
62,0.002883134875446558,2026-08-05 14:51:38.994075,2026-08-05 14:51:42.727550,0 days 00:00:03.733475,8,0.31543892502186915,13,0.000727401328790032,RMSprop,8,55,COMPLETE
63,0.0026383998338133097,2026-08-05 14:51:42.727578,2026-08-05 14:51:47.266056,0 days 00:00:04.538478,8,0.3310397065282294,13,0.0007153692711612832,RMSprop,8,68,COMPLETE
64,0.004405551124364138,2026-08-05 14:51:47.266092,2026-08-05 14:51:50.611510,0 days 00:00:03.345418,8,0.3183870051286939,13,0.0007135058278065672,RMSprop,8,46,COMPLETE
65,0.003394617699086666,2026-08-05 14:51:50.611539,2026-08-05 14:51:53.575541,0 days 00:00:02.964002,8,0.28371998460898856,13,0.0007912882108485406,RMSprop,8,38,COMPLETE
66,0.0034212220925837755,2026-08-05 14:51:53.575574,2026-08-05 14:51:57.955113,0 days 00:00:04.379539,8,0.32704312416271725,13,0.0005668694620028631,RMSprop,8,65,COMPLETE
67,0.00601978600025177,2026-08-05 14:51:57.955143,2026-08-05 14:52:01.553491,0 days 00:00:03.598348,8,0.29342913731923126,13,0.0007410094415611995,RMSprop,8,53,COMPLETE
68,0.0073603177443146706,2026-08-05 14:52:01.553519,2026-08-05 14:52:05.304188,0 days 00:00:03.750669,8,0.36708515769797745,13,0.0007020397865434881,RMSprop,8,52,COMPLETE
69,0.0036403473932296038,2026-08-05 14:52:05.304219,2026-08-05 14:52:09.243508,0 days 00:00:03.939289,8,0.3199798125109549,13,0.0004749571489126837,RMSprop,8,55,COMPLETE
70,0.002917923964560032,2026-08-05 14:52:09.243539,2026-08-05 14:52:12.004060,0 days 00:00:02.760521,8,0.3836960185908358,13,0.0008000154189990601,RMSprop,8,35,COMPLETE
71,0.01268264465034008,2026-08-05 14:52:12.004100,2026-08-05 14:52:15.658074,0 days 00:00:03.653974,8,0.3443454478516203,13,0.0008058377856613242,RMSprop,8,50,COMPLETE
72,0.00404439028352499,2026-08-05 14:52:15.658106,2026-08-05 14:52:20.193969,0 days 00:00:04.535863,8,0.3838350335022362,13,0.0006754530240978714,RMSprop,8,67,COMPLETE
73,0.0036059622652828693,2026-08-05 14:52:20.193996,2026-08-05 14:52:23.382094,0 days 00:00:03.188098,8,0.30610283250841575,13,0.0009265901707560813,RMSprop,8,43,COMPLETE
74,0.0049188267439603806,2026-08-05 14:52:23.382131,2026-08-05 14:52:27.812607,0 days 00:00:04.430476,8,0.40671998826660716,13,0.0007995153136960044,RMSprop,8,61,COMPLETE
