number,value,datetime_start,datetime_complete,duration,params_batch,params_dropout,params_lookback,params_lr,params_optimizer,params_units,user_attrs_epochs,state
0,0.004222535528242588,2026-08-04 23:13:55.632051,2026-08-04 23:13:59.923473,0 days 00:00:04.291422,8,0.23484878080972746,8,0.0006076358235679542,Adam,16,87,COMPLETE
1,0.023489315062761307,2026-08-04 23:13:59.923848,2026-08-04 23:14:02.353715,0 days 00:00:02.429867,8,0.37095084646071336,8,0.0007509800655397563,RMSprop,16,43,COMPLETE
2,0.011220399290323257,2026-08-04 23:14:02.354111,2026-08-04 23:14:05.382837,0 days 00:00:03.028726,16,0.36078995614157006,8,0.00037888328904744857,Adam,16,50,COMPLETE
3,0.06259611994028091,2026-08-04 23:14:05.383328,2026-08-04 23:14:09.580930,0 days 00:00:04.197602,16,0.11028847762386346,4,0.00010064498649174304,Adam,16,113,COMPLETE
4,0.07358389347791672,2026-08-04 23:14:09.581535,2026-08-04 23:14:10.942634,0 days 00:00:01.361099,16,0.23840032507581052,4,0.0001735858685607386,Adam,32,17,COMPLETE
5,0.02610979974269867,2026-08-04 23:14:10.943065,2026-08-04 23:14:12.860950,0 days 00:00:01.917885,8,0.42136678242899145,8,0.0001833424218432864,Adam,32,28,COMPLETE
6,0.18999217450618744,2026-08-04 23:14:12.861517,2026-08-04 23:14:16.021397,0 days 00:00:03.159880,8,0.44664564392125106,13,0.0002751150414368779,RMSprop,32,39,COMPLETE
7,0.037559133023023605,2026-08-04 23:14:16.022004,2026-08-04 23:14:18.679967,0 days 00:00:02.657963,8,0.4315770040291383,4,0.00012175832832850674,RMSprop,32,40,COMPLETE
8,0.09523339569568634,2026-08-04 23:14:18.680435,2026-08-04 23:14:19.924925,0 days 00:00:01.244490,16,0.2757780578988199,4,0.00034863077442141876,RMSprop,8,16,COMPLETE
9,0.00824908260256052,2026-08-04 23:14:19.925346,2026-08-04 23:14:25.171199,0 days 00:00:05.245853,16,0.38244836081660555,4,0.0003281952990485561,Adam,16,150,COMPLETE
10,0.006557055748999119,2026-08-04 23:14:25.171716,2026-08-04 23:14:30.137456,0 days 00:00:04.965740,8,0.17790459545505605,13,0.000986976448094658,Adam,8,72,COMPLETE
11,0.05667835474014282,2026-08-04 23:14:30.137823,2026-08-04 23:14:32.084917,0 days 00:00:01.947094,8,0.17618825186921006,13,0.0009884917163000867,Adam,8,20,COMPLETE
12,0.03840493783354759,2026-08-04 23:14:32.085317,2026-08-04 23:14:37.048509,0 days 00:00:04.963192,8,0.22389097836106603,13,0.0006011445128516145,Adam,8,73,COMPLETE
13,0.02057909220457077,2026-08-04 23:14:37.048900,2026-08-04 23:14:39.225919,0 days 00:00:02.177019,8,0.16019026297584543,13,0.0005405295859706402,Adam,8,24,COMPLETE
14,0.030606742948293686,2026-08-04 23:14:39.226336,2026-08-04 23:14:41.583810,0 days 00:00:02.357474,8,0.2920438979604447,8,0.0009661667311954186,Adam,16,40,COMPLETE
15,0.008849620819091797,2026-08-04 23:14:41.584309,2026-08-04 23:14:48.008245,0 days 00:00:06.423936,8,0.19984857872650297,13,0.0005297549980896705,Adam,8,99,COMPLETE
16,0.0870211198925972,2026-08-04 23:14:48.008846,2026-08-04 23:14:49.363721,0 days 00:00:01.354875,8,0.11729598237400492,8,0.0007396419003290273,Adam,8,16,COMPLETE
17,0.014779235236346722,2026-08-04 23:14:49.364545,2026-08-04 23:14:52.997552,0 days 00:00:03.633007,8,0.31949519671988635,8,0.0004512258087430283,Adam,16,71,COMPLETE
18,0.019993651658296585,2026-08-04 23:14:52.998021,2026-08-04 23:14:54.956130,0 days 00:00:01.958109,8,0.23798474026730126,13,0.0007437095181958966,RMSprop,8,22,COMPLETE
19,0.04293438792228699,2026-08-04 23:14:54.956508,2026-08-04 23:14:58.605344,0 days 00:00:03.648836,8,0.16308000808680997,8,0.0008182259606081245,Adam,16,71,COMPLETE
20,0.06266074627637863,2026-08-04 23:14:58.605839,2026-08-04 23:15:07.692920,0 days 00:00:09.087081,8,0.3070142028356801,13,0.00026520755343392087,Adam,8,145,COMPLETE
21,0.023658936843276024,2026-08-04 23:15:07.693476,2026-08-04 23:15:10.853405,0 days 00:00:03.159929,16,0.36167704830849173,4,0.0002235117848184804,Adam,16,48,COMPLETE
22,0.015221551060676575,2026-08-04 23:15:10.853889,2026-08-04 23:15:12.798490,0 days 00:00:01.944601,16,0.2019219174353632,4,0.00043216610951525076,Adam,16,35,COMPLETE
23,0.0078585185110569,2026-08-04 23:15:12.798862,2026-08-04 23:15:15.005059,0 days 00:00:02.206197,16,0.2689815785299374,4,0.0006669225611323587,Adam,16,45,COMPLETE
24,0.04566260427236557,2026-08-04 23:15:15.005440,2026-08-04 23:15:16.370632,0 days 00:00:01.365192,16,0.2634682404251364,8,0.0006401370282197802,Adam,16,16,COMPLETE
25,0.04251682013273239,2026-08-04 23:15:16.371221,2026-08-04 23:15:17.863554,0 days 00:00:01.492333,16,0.24939045537148644,13,0.0008562651812255931,Adam,16,18,COMPLETE
26,0.15145041048526764,2026-08-04 23:15:17.864080,2026-08-04 23:15:19.108961,0 days 00:00:01.244881,16,0.13551209253074092,4,0.0006278066606893786,RMSprop,16,16,COMPLETE
27,0.9149144887924194,2026-08-04 23:15:19.109393,2026-08-04 23:15:20.926919,0 days 00:00:01.817526,8,0.20820067544315746,13,0.00047099604643524454,Adam,16,16,COMPLETE
28,0.013760292902588844,2026-08-04 23:15:20.927338,2026-08-04 23:15:23.264125,0 days 00:00:02.336787,16,0.3340753176589902,4,0.0006574481925101404,Adam,32,50,COMPLETE
29,0.010762982070446014,2026-08-04 23:15:23.265087,2026-08-04 23:15:25.886573,0 days 00:00:02.621486,8,0.18152513383932442,8,0.0008668662484780363,RMSprop,8,50,COMPLETE
30,0.022352198138833046,2026-08-04 23:15:25.886975,2026-08-04 23:15:27.525664,0 days 00:00:01.638689,8,0.27957657556967047,8,0.0007252393043270858,Adam,16,22,COMPLETE
31,0.03133820742368698,2026-08-04 23:15:27.526039,2026-08-04 23:15:29.049081,0 days 00:00:01.523042,16,0.40085421460525344,4,0.0005352839229331439,Adam,16,23,COMPLETE
32,0.1726830005645752,2026-08-04 23:15:29.049534,2026-08-04 23:15:31.671150,0 days 00:00:02.621616,16,0.39312925705398927,4,0.00037623513482299526,Adam,16,59,COMPLETE
33,0.05368629842996597,2026-08-04 23:15:31.671604,2026-08-04 23:15:33.489589,0 days 00:00:01.817985,16,0.257783647585597,4,0.0009758581276158838,Adam,16,32,COMPLETE
34,0.16781392693519592,2026-08-04 23:15:33.490179,2026-08-04 23:15:38.730826,0 days 00:00:05.240647,16,0.3390935842322956,4,0.00033552209716893435,Adam,16,150,COMPLETE
35,0.01428641565144062,2026-08-04 23:15:38.731233,2026-08-04 23:15:41.411034,0 days 00:00:02.679801,16,0.3000887761328309,4,0.00040642742035863793,Adam,16,63,COMPLETE
36,0.19597581028938293,2026-08-04 23:15:41.411452,2026-08-04 23:15:42.790192,0 days 00:00:01.378740,16,0.2259234708314051,8,0.00016942231600234578,Adam,16,16,COMPLETE
37,0.03120666928589344,2026-08-04 23:15:42.790578,2026-08-04 23:15:44.725085,0 days 00:00:01.934507,16,0.13565859290388604,4,0.000288084927401324,Adam,32,36,COMPLETE
38,0.1541707068681717,2026-08-04 23:15:44.725595,2026-08-04 23:15:49.167808,0 days 00:00:04.442213,16,0.3861770125845858,4,0.0002213767904884342,RMSprop,16,128,COMPLETE
39,0.15029102563858032,2026-08-04 23:15:49.168248,2026-08-04 23:15:50.965651,0 days 00:00:01.797403,8,0.21653833015551424,13,0.00014974339043402756,Adam,32,16,COMPLETE
40,0.008747206069529057,2026-08-04 23:15:50.966104,2026-08-04 23:15:53.898248,0 days 00:00:02.932144,8,0.18896171632486236,8,0.0008056376157086169,Adam,8,54,COMPLETE
41,0.036497779190540314,2026-08-04 23:15:53.898817,2026-08-04 23:15:59.603074,0 days 00:00:05.704257,8,0.18394566861909897,8,0.0008303927400506557,Adam,8,122,COMPLETE
42,0.09422293305397034,2026-08-04 23:15:59.603813,2026-08-04 23:16:01.899224,0 days 00:00:02.295411,8,0.23552210519021127,8,0.0006927581568030497,Adam,8,39,COMPLETE
43,0.1988922357559204,2026-08-04 23:16:01.899730,2026-08-04 23:16:07.639873,0 days 00:00:05.740143,8,0.14473501869666708,8,0.0005618052564140722,Adam,8,123,COMPLETE
44,0.007801466155797243,2026-08-04 23:16:07.640271,2026-08-04 23:16:13.562494,0 days 00:00:05.922223,8,0.27711405543653034,8,0.0008710147312560017,Adam,8,101,COMPLETE
45,0.22334842383861542,2026-08-04 23:16:13.562932,2026-08-04 23:16:14.991417,0 days 00:00:01.428485,8,0.2769634788303443,8,0.0008915913448292028,Adam,8,17,COMPLETE
46,0.005373567808419466,2026-08-04 23:16:14.991829,2026-08-04 23:16:18.099834,0 days 00:00:03.108005,8,0.4456900365460235,13,0.000491550344735928,RMSprop,8,40,COMPLETE
47,0.007540943566709757,2026-08-04 23:16:18.100287,2026-08-04 23:16:24.305689,0 days 00:00:06.205402,8,0.4405581909406632,13,0.00047871319662654114,RMSprop,8,91,COMPLETE
48,0.021192051470279694,2026-08-04 23:16:24.306459,2026-08-04 23:16:27.243476,0 days 00:00:02.937017,8,0.44642495197351356,13,0.0005052941201278755,RMSprop,8,37,COMPLETE
49,0.029592515900731087,2026-08-04 23:16:27.243876,2026-08-04 23:16:29.121506,0 days 00:00:01.877630,8,0.4146782596267766,13,0.000489015978854752,RMSprop,8,19,COMPLETE
50,0.01480476651340723,2026-08-04 23:16:29.122007,2026-08-04 23:16:34.257877,0 days 00:00:05.135870,8,0.4209833001796948,13,0.0005839584612438972,RMSprop,8,76,COMPLETE
51,0.010502039454877377,2026-08-04 23:16:34.258475,2026-08-04 23:16:36.903882,0 days 00:00:02.645407,8,0.4469959445515026,13,0.0009262030463952685,RMSprop,8,33,COMPLETE
52,0.006967376451939344,2026-08-04 23:16:36.904431,2026-08-04 23:16:45.664150,0 days 00:00:08.759719,8,0.3716493001319323,13,0.0006781301564448924,RMSprop,8,140,COMPLETE
53,0.045944273471832275,2026-08-04 23:16:45.664672,2026-08-04 23:16:47.385490,0 days 00:00:01.720818,8,0.4342159439436766,13,0.0007302650146130794,RMSprop,8,16,COMPLETE
54,0.0038766798097640276,2026-08-04 23:16:47.385986,2026-08-04 23:16:52.023525,0 days 00:00:04.637539,8,0.37499019307738285,13,0.000785496879171894,RMSprop,8,68,COMPLETE
55,0.027110053226351738,2026-08-04 23:16:52.023919,2026-08-04 23:16:58.144506,0 days 00:00:06.120587,8,0.3615922106584139,13,0.0005801199226920347,RMSprop,8,94,COMPLETE
56,0.005043754354119301,2026-08-04 23:16:58.145015,2026-08-04 23:17:05.194458,0 days 00:00:07.049443,8,0.4161498588327691,13,0.00041323139055888413,RMSprop,8,111,COMPLETE
57,0.012542052194476128,2026-08-04 23:17:05.194914,2026-08-04 23:17:09.257552,0 days 00:00:04.062638,8,0.40744740518740197,13,0.0003782021020969782,RMSprop,8,58,COMPLETE
58,0.022902267053723335,2026-08-04 23:17:09.258033,2026-08-04 23:17:14.381172,0 days 00:00:05.123139,8,0.3686797501507275,13,0.0004188002967630237,RMSprop,8,76,COMPLETE
59,0.04274020716547966,2026-08-04 23:17:14.381583,2026-08-04 23:17:16.007345,0 days 00:00:01.625762,8,0.3485252594586775,13,0.0006063078392660625,RMSprop,8,16,COMPLETE
60,0.02902672439813614,2026-08-04 23:17:16.007726,2026-08-04 23:17:18.924187,0 days 00:00:02.916461,8,0.37842460760180036,13,0.0007921437637112958,RMSprop,8,37,COMPLETE
61,0.007301422767341137,2026-08-04 23:17:18.924596,2026-08-04 23:17:25.056651,0 days 00:00:06.132055,8,0.43038615946970243,13,0.0004460143014728956,RMSprop,8,94,COMPLETE
62,0.023226354271173477,2026-08-04 23:17:25.057138,2026-08-04 23:17:29.407742,0 days 00:00:04.350604,8,0.42920329527700474,13,0.0004402070915409975,RMSprop,8,63,COMPLETE
63,0.31087130308151245,2026-08-04 23:17:29.408159,2026-08-04 23:17:38.713968,0 days 00:00:09.305809,8,0.10196923417804993,13,0.0005303948523628629,RMSprop,8,150,COMPLETE
64,0.03448459878563881,2026-08-04 23:17:38.714355,2026-08-04 23:17:42.611638,0 days 00:00:03.897283,8,0.40193740089534186,13,0.0006859758666702654,RMSprop,8,56,COMPLETE
65,0.05358660966157913,2026-08-04 23:17:42.612116,2026-08-04 23:17:45.237810,0 days 00:00:02.625694,8,0.41721263608167847,13,0.00035494525697302674,RMSprop,32,31,COMPLETE
66,0.0042103673331439495,2026-08-04 23:17:45.238366,2026-08-04 23:17:51.310958,0 days 00:00:06.072592,8,0.4288906235145521,13,0.0004007097821595681,RMSprop,8,93,COMPLETE
67,0.009027923457324505,2026-08-04 23:17:51.311623,2026-08-04 23:17:56.958233,0 days 00:00:05.646610,8,0.38823374523923887,13,0.0002927779587258637,RMSprop,8,86,COMPLETE
68,0.0892629325389862,2026-08-04 23:17:56.958598,2026-08-04 23:17:59.194550,0 days 00:00:02.235952,8,0.1666910959018531,13,0.00039649960308784846,RMSprop,8,27,COMPLETE
69,0.01754738762974739,2026-08-04 23:17:59.195091,2026-08-04 23:18:01.583097,0 days 00:00:02.388006,8,0.39588175569263495,13,0.0007821926576108974,RMSprop,8,27,COMPLETE
70,0.004812312312424183,2026-08-04 23:18:01.583566,2026-08-04 23:18:04.523514,0 days 00:00:02.939948,8,0.3185883588285532,13,0.0006221337292978826,RMSprop,8,39,COMPLETE
71,0.059160515666007996,2026-08-04 23:18:04.523910,2026-08-04 23:18:09.444471,0 days 00:00:04.920561,8,0.3204677335840697,13,0.000611635571263238,RMSprop,8,72,COMPLETE
72,0.03052041307091713,2026-08-04 23:18:09.444912,2026-08-04 23:18:13.393727,0 days 00:00:03.948815,8,0.3518614734693353,13,0.000993006264982423,RMSprop,8,56,COMPLETE
73,0.010546688921749592,2026-08-04 23:18:13.394216,2026-08-04 23:18:19.392941,0 days 00:00:05.998725,8,0.408858931417116,13,0.0006358292656008218,RMSprop,8,65,COMPLETE
74,0.008753507398068905,2026-08-04 23:18:19.393328,2026-08-04 23:18:24.533949,0 days 00:00:05.140621,8,0.3711199747659106,13,0.0005129291105877277,RMSprop,8,72,COMPLETE
