number,value,datetime_start,datetime_complete,duration,params_batch,params_dropout,params_lookback,params_lr,params_optimizer,params_units,user_attrs_epochs,state
0,0.021357892081141472,2026-08-04 23:39:58.208605,2026-08-04 23:40:02.274437,0 days 00:00:04.065832,8,0.4310367232451352,13,0.0006144051454701926,Adam,8,54,COMPLETE
1,0.02112705260515213,2026-08-04 23:40:02.274908,2026-08-04 23:40:03.671816,0 days 00:00:01.396908,8,0.13109969485707482,8,0.0005626060606843514,RMSprop,16,17,COMPLETE
2,0.020486127585172653,2026-08-04 23:40:03.672277,2026-08-04 23:40:06.322218,0 days 00:00:02.649941,8,0.24730573334276595,13,0.000986600929060816,RMSprop,8,32,COMPLETE
3,0.07717366516590118,2026-08-04 23:40:06.322618,2026-08-04 23:40:11.244466,0 days 00:00:04.921848,16,0.4461053333082709,13,0.00043649497570660855,Adam,8,105,COMPLETE
4,0.01969750039279461,2026-08-04 23:40:11.245004,2026-08-04 23:40:14.254524,0 days 00:00:03.009520,8,0.34788248942200756,8,0.00043895724440424995,Adam,16,50,COMPLETE
5,0.03735863044857979,2026-08-04 23:40:14.254925,2026-08-04 23:40:16.664200,0 days 00:00:02.409275,16,0.4327320869352919,13,0.0002357584834971284,RMSprop,32,40,COMPLETE
6,0.013756782747805119,2026-08-04 23:40:16.664620,2026-08-04 23:40:26.250241,0 days 00:00:09.585621,8,0.3609920993932019,13,0.0001428303966341566,RMSprop,16,150,COMPLETE
7,0.02385871857404709,2026-08-04 23:40:26.250699,2026-08-04 23:40:31.541327,0 days 00:00:05.290628,16,0.213994384601169,13,0.0006141291042932715,RMSprop,16,118,COMPLETE
8,0.014298120513558388,2026-08-04 23:40:31.541732,2026-08-04 23:40:33.913556,0 days 00:00:02.371824,8,0.20401176097283694,4,0.0005739646124047868,Adam,16,34,COMPLETE
9,0.03629877418279648,2026-08-04 23:40:33.914601,2026-08-04 23:40:36.093238,0 days 00:00:02.178637,16,0.40345394728270595,8,0.0003006300246497634,RMSprop,32,40,COMPLETE
10,0.008845454081892967,2026-08-04 23:40:36.093712,2026-08-04 23:40:43.005939,0 days 00:00:06.912227,8,0.3191236150707125,4,0.00011275986254461589,RMSprop,16,150,COMPLETE
11,0.022989539429545403,2026-08-04 23:40:43.006412,2026-08-04 23:40:49.900084,0 days 00:00:06.893672,8,0.33161960886390035,4,0.00010408544951004655,RMSprop,16,150,COMPLETE
12,0.007842078804969788,2026-08-04 23:40:49.900613,2026-08-04 23:40:54.096016,0 days 00:00:04.195403,8,0.32210726583346994,4,0.00011855701835938215,RMSprop,16,80,COMPLETE
13,0.08777716755867004,2026-08-04 23:40:54.096549,2026-08-04 23:40:55.604907,0 days 00:00:01.508358,8,0.2974353451444894,4,0.00016695897250850955,RMSprop,16,16,COMPLETE
14,0.01602940261363983,2026-08-04 23:40:55.605419,2026-08-04 23:40:59.313234,0 days 00:00:03.707815,8,0.2825788740399292,4,0.00011855337262813314,RMSprop,32,68,COMPLETE
15,0.010012690909206867,2026-08-04 23:40:59.313646,2026-08-04 23:41:01.811896,0 days 00:00:02.498250,8,0.31698479263343016,4,0.00020430220490726906,RMSprop,16,40,COMPLETE
16,0.0143071124330163,2026-08-04 23:41:01.812430,2026-08-04 23:41:07.563331,0 days 00:00:05.750901,8,0.37827571921579844,4,0.0001508608566353209,RMSprop,16,121,COMPLETE
17,0.016631389036774635,2026-08-04 23:41:07.563827,2026-08-04 23:41:09.751827,0 days 00:00:02.188000,8,0.25172866891667306,4,0.00021232339338955687,RMSprop,16,33,COMPLETE
18,0.06880299001932144,2026-08-04 23:41:09.752293,2026-08-04 23:41:12.643264,0 days 00:00:02.890971,16,0.14799132256704817,4,0.00010261464763036443,Adam,8,65,COMPLETE
19,0.015688829123973846,2026-08-04 23:41:12.644066,2026-08-04 23:41:17.356513,0 days 00:00:04.712447,8,0.3908279558123155,4,0.00013038035584053212,RMSprop,32,93,COMPLETE
20,0.09589604288339615,2026-08-04 23:41:17.356996,2026-08-04 23:41:19.717673,0 days 00:00:02.360677,8,0.3080896453777868,4,0.0001752839298577732,RMSprop,16,37,COMPLETE
21,0.07736461609601974,2026-08-04 23:41:19.718133,2026-08-04 23:41:21.342048,0 days 00:00:01.623915,8,0.32455471044000256,4,0.0002010917351858406,RMSprop,16,16,COMPLETE
22,0.015623744577169418,2026-08-04 23:41:21.342909,2026-08-04 23:41:24.811508,0 days 00:00:03.468599,8,0.25787431656883414,4,0.0002570253602567507,RMSprop,16,60,COMPLETE
23,0.015828588977456093,2026-08-04 23:41:24.811987,2026-08-04 23:41:27.365781,0 days 00:00:02.553794,8,0.34030818332571006,4,0.00012434239454827523,RMSprop,16,41,COMPLETE
24,0.14362755417823792,2026-08-04 23:41:27.366435,2026-08-04 23:41:30.963129,0 days 00:00:03.596694,8,0.21447046898802313,4,0.00018064733671099977,RMSprop,16,66,COMPLETE
25,0.01694580353796482,2026-08-04 23:41:30.963542,2026-08-04 23:41:34.130877,0 days 00:00:03.167335,8,0.30819669594661125,8,0.0001000264648727483,RMSprop,16,61,COMPLETE
26,0.019222743809223175,2026-08-04 23:41:34.131543,2026-08-04 23:41:35.806703,0 days 00:00:01.675160,16,0.2750634494518621,4,0.0003124150303864374,Adam,16,23,COMPLETE
27,0.007250371854752302,2026-08-04 23:41:35.807138,2026-08-04 23:41:41.877985,0 days 00:00:06.070847,8,0.379614621932961,4,0.00015170853898631442,RMSprop,16,127,COMPLETE
28,0.02922559529542923,2026-08-04 23:41:41.878783,2026-08-04 23:41:44.401133,0 days 00:00:02.522350,8,0.3691929799317042,4,0.000147843635218402,RMSprop,32,36,COMPLETE
29,0.008989890106022358,2026-08-04 23:41:44.401624,2026-08-04 23:41:51.458081,0 days 00:00:07.056457,8,0.4115444407244361,8,0.00013573666000063885,Adam,8,150,COMPLETE
30,0.005999634508043528,2026-08-04 23:41:51.458600,2026-08-04 23:41:58.369204,0 days 00:00:06.910604,8,0.41580876883552054,4,0.00011402738960970969,RMSprop,8,150,COMPLETE
31,0.009118747897446156,2026-08-04 23:41:58.369655,2026-08-04 23:42:04.995812,0 days 00:00:06.626157,8,0.41774999856640965,4,0.00011697448101147399,RMSprop,8,144,COMPLETE
32,0.08422005921602249,2026-08-04 23:42:04.996274,2026-08-04 23:42:06.839731,0 days 00:00:01.843457,8,0.35638238036494096,4,0.00011568310507009802,RMSprop,8,25,COMPLETE
33,0.04193761199712753,2026-08-04 23:42:06.840264,2026-08-04 23:42:08.830597,0 days 00:00:01.990333,8,0.3906774233175754,4,0.00016585800002838415,RMSprop,8,26,COMPLETE
34,0.045707929879426956,2026-08-04 23:42:08.831348,2026-08-04 23:42:15.654990,0 days 00:00:06.823642,8,0.44749907322542726,4,0.00011367652208696688,RMSprop,8,150,COMPLETE
35,0.08700083196163177,2026-08-04 23:42:15.655490,2026-08-04 23:42:18.389604,0 days 00:00:02.734114,8,0.3790339267830649,8,0.0007691915095815367,RMSprop,8,51,COMPLETE
36,0.25320637226104736,2026-08-04 23:42:18.390077,2026-08-04 23:42:20.424611,0 days 00:00:02.034534,8,0.4290110610707306,13,0.00041746414243429454,Adam,8,18,COMPLETE
37,0.08148088306188583,2026-08-04 23:42:20.425113,2026-08-04 23:42:27.436897,0 days 00:00:07.011784,16,0.3465461679761669,4,0.00015132390924148297,RMSprop,16,28,COMPLETE
38,0.07295440882444382,2026-08-04 23:42:27.437463,2026-08-04 23:42:29.412371,0 days 00:00:01.974908,8,0.2921447602961407,13,0.00013847104674360585,RMSprop,16,16,COMPLETE
39,0.06591033190488815,2026-08-04 23:42:29.412775,2026-08-04 23:42:31.217951,0 days 00:00:01.805176,8,0.3982130703075778,4,0.00039300068827237666,RMSprop,16,16,COMPLETE
40,0.030905498191714287,2026-08-04 23:42:31.218424,2026-08-04 23:42:38.178424,0 days 00:00:06.960000,16,0.11327883548801307,13,0.0002540204596987302,Adam,8,147,COMPLETE
41,0.017958348616957664,2026-08-04 23:42:38.179278,2026-08-04 23:42:45.023606,0 days 00:00:06.844328,8,0.4260289521895581,8,0.00013282959967005932,Adam,8,135,COMPLETE
42,0.017739512026309967,2026-08-04 23:42:45.024149,2026-08-04 23:42:48.926128,0 days 00:00:03.901979,8,0.41314948976815036,8,0.00010872294239119588,Adam,8,70,COMPLETE
43,0.15749667584896088,2026-08-04 23:42:48.926593,2026-08-04 23:42:56.133851,0 days 00:00:07.207258,8,0.3630807760142318,8,0.00013070890166029812,Adam,8,150,COMPLETE
44,0.013702662661671638,2026-08-04 23:42:56.134460,2026-08-04 23:43:03.300142,0 days 00:00:07.165682,8,0.4072237152979482,8,0.0001579235502061572,Adam,8,150,COMPLETE
45,0.03277052193880081,2026-08-04 23:43:03.300578,2026-08-04 23:43:05.333865,0 days 00:00:02.033287,8,0.4395019169973402,8,0.00018639615271601032,Adam,32,26,COMPLETE
46,0.06031960994005203,2026-08-04 23:43:05.334546,2026-08-04 23:43:12.355531,0 days 00:00:07.020985,8,0.3796351828806489,8,0.00012124197942941489,RMSprop,16,150,COMPLETE
47,0.014328314922749996,2026-08-04 23:43:12.356098,2026-08-04 23:43:19.584346,0 days 00:00:07.228248,8,0.3424458284564248,4,0.00013904178427431047,Adam,8,150,COMPLETE
48,0.11342289298772812,2026-08-04 23:43:19.584765,2026-08-04 23:43:20.970172,0 days 00:00:01.385407,16,0.35660526907016304,4,0.00010992140141906129,RMSprop,16,16,COMPLETE
49,0.004957176744937897,2026-08-04 23:43:20.970653,2026-08-04 23:43:23.781055,0 days 00:00:02.810402,8,0.39255837965527474,13,0.0009839022062530596,RMSprop,32,32,COMPLETE
50,0.024541983380913734,2026-08-04 23:43:23.781536,2026-08-04 23:43:26.615145,0 days 00:00:02.833609,8,0.3326047834674307,13,0.0008843774802686143,RMSprop,32,30,COMPLETE
51,0.03404074162244797,2026-08-04 23:43:26.616010,2026-08-04 23:43:29.488944,0 days 00:00:02.872934,8,0.39514094498671887,13,0.0003642428276706632,RMSprop,32,30,COMPLETE
52,0.13826599717140198,2026-08-04 23:43:29.489498,2026-08-04 23:43:33.875395,0 days 00:00:04.385897,8,0.416364267088247,13,0.00022463950335743188,RMSprop,32,57,COMPLETE
53,0.13520385324954987,2026-08-04 23:43:33.875844,2026-08-04 23:43:36.093085,0 days 00:00:02.217241,8,0.37600707378182274,13,0.00048073431906420943,RMSprop,32,22,COMPLETE
54,0.01714184880256653,2026-08-04 23:43:36.093746,2026-08-04 23:43:37.961523,0 days 00:00:01.867777,8,0.43162304137964785,4,0.0006967012458831631,RMSprop,16,23,COMPLETE
55,0.03505192697048187,2026-08-04 23:43:37.961988,2026-08-04 23:43:40.618419,0 days 00:00:02.656431,8,0.39239169798008533,13,0.00012532052985763384,RMSprop,32,29,COMPLETE
56,0.0549103282392025,2026-08-04 23:43:40.618874,2026-08-04 23:43:43.297550,0 days 00:00:02.678676,8,0.32035912364040475,4,0.000277630264419342,RMSprop,16,44,COMPLETE
57,0.13621796667575836,2026-08-04 23:43:43.298056,2026-08-04 23:43:48.020031,0 days 00:00:04.721975,8,0.2610215767302295,4,0.0005038514648965397,RMSprop,16,93,COMPLETE
58,0.18952380120754242,2026-08-04 23:43:48.020820,2026-08-04 23:43:51.727362,0 days 00:00:03.706542,16,0.3005634875942491,8,0.00010076807995658742,Adam,32,80,COMPLETE
59,0.014120685867965221,2026-08-04 23:43:51.727747,2026-08-04 23:43:57.792913,0 days 00:00:06.065166,8,0.1625450525032503,4,0.0001926931071618694,RMSprop,16,127,COMPLETE
60,0.019083235412836075,2026-08-04 23:43:57.794302,2026-08-04 23:44:04.747260,0 days 00:00:06.952958,8,0.40528772994822027,4,0.00016402954186607626,RMSprop,8,150,COMPLETE
61,0.013368501327931881,2026-08-04 23:44:04.747752,2026-08-04 23:44:11.728743,0 days 00:00:06.980991,8,0.44571284931345156,4,0.00012021595842648881,RMSprop,8,150,COMPLETE
62,0.029659857973456383,2026-08-04 23:44:11.729265,2026-08-04 23:44:18.630878,0 days 00:00:06.901613,8,0.416433662451988,4,0.00011021777199922884,RMSprop,8,150,COMPLETE
63,0.04386133700609207,2026-08-04 23:44:18.631362,2026-08-04 23:44:20.818825,0 days 00:00:02.187463,8,0.42214815615471046,4,0.0001438113692778602,RMSprop,8,32,COMPLETE
64,0.006055869627743959,2026-08-04 23:44:20.819289,2026-08-04 23:44:23.304215,0 days 00:00:02.484926,8,0.38291205484890245,4,0.0009825924460387567,RMSprop,8,36,COMPLETE
65,0.006606877315789461,2026-08-04 23:44:23.305051,2026-08-04 23:44:26.875005,0 days 00:00:03.569954,8,0.3693473209901655,4,0.0009373885751947162,RMSprop,8,67,COMPLETE
66,0.06281446665525436,2026-08-04 23:44:26.875403,2026-08-04 23:44:28.532886,0 days 00:00:01.657483,8,0.3704470833719661,4,0.0009739339385385484,RMSprop,16,16,COMPLETE
67,0.007586898282170296,2026-08-04 23:44:28.533305,2026-08-04 23:44:31.786226,0 days 00:00:03.252921,8,0.32956306101777305,4,0.0008021680777459359,RMSprop,8,59,COMPLETE
68,0.02774937078356743,2026-08-04 23:44:31.786628,2026-08-04 23:44:34.582203,0 days 00:00:02.795575,8,0.3329405532214755,4,0.0007898048079380363,RMSprop,8,46,COMPLETE
69,0.052705567330121994,2026-08-04 23:44:34.582636,2026-08-04 23:44:37.884654,0 days 00:00:03.302018,8,0.3853705931800352,4,0.000976945131874756,RMSprop,8,61,COMPLETE
70,0.022194653749465942,2026-08-04 23:44:37.885108,2026-08-04 23:44:40.456140,0 days 00:00:02.571032,16,0.35307530406137516,4,0.000860322063889551,RMSprop,8,56,COMPLETE
71,0.00724875507876277,2026-08-04 23:44:40.456635,2026-08-04 23:44:43.381881,0 days 00:00:02.925246,8,0.3149686731733674,4,0.0006795153861647006,RMSprop,8,51,COMPLETE
72,0.13099230825901031,2026-08-04 23:44:43.382296,2026-08-04 23:44:46.810683,0 days 00:00:03.428387,8,0.2844203707348383,4,0.0006681294870262643,RMSprop,8,63,COMPLETE
73,0.05975379794836044,2026-08-04 23:44:46.811409,2026-08-04 23:44:51.769537,0 days 00:00:04.958128,8,0.31199418871308937,4,0.0008469363909404809,RMSprop,8,103,COMPLETE
74,0.031808484345674515,2026-08-04 23:44:51.770075,2026-08-04 23:44:55.821303,0 days 00:00:04.051228,8,0.36368585398701436,4,0.0009235236204541818,RMSprop,8,77,COMPLETE
